uid,title,synopsis,genre,aired,episodes,members,popularity,ranked,score,img_url,link
40651,Kandagawa Jet Girls Recap,Recap of the first four episodes of  Kandagawa Jet Girls .,"['Sports', 'Ecchi']","Nov 5, 2019",1.0,1126,9284,10506.0,5.25,https://cdn.myanimelist.net/images/anime/1851/103980.jpg,https://myanimelist.net/anime/40651/Kandagawa_Jet_Girls_Recap
20385,Eguchi Hisashi no Kotobuki Gorou Show,"Based on the gag manga by Hisashi Eguchi. 
 
Originally released as a feature part of Studio Pierrot's video magazine show Anime V Comic Rentaman (アニメ・V・コミック レンタマン) along with Abashiri Ikka, Yumemakura Baku Twilight Gekijou and Akai Hayate.  
 
(Source: AniDB) ","['Comedy', 'Parody', 'Ecchi']","May 21, 1991 to Nov 21, 1991",4.0,895,9764,10501.0,5.24,https://cdn.myanimelist.net/images/anime/13/54143.jpg,https://myanimelist.net/anime/20385/Eguchi_Hisashi_no_Kotobuki_Gorou_Show
31491,Hantsu x Trash,"Hamaji Youhei, a high school freshman, lives his life aimlessly, lazing around all day. He can't keep up with his studies, no good at sports and won't stick with anything for long. Besides that he's a pervert who's continuously rejected by girls. A sophomore convinces him into joining a club where he could lunge at girls, fondling and touching all he wanted. Thus he joined the Water Polo Club. 
  
Can Youhei, who never sticks with anything for long, find his place in this club?","['Comedy', 'Ecchi', 'Romance', 'School', 'Seinen', 'Sports']","Oct 6, 2015 to Nov 4, 2016",3.0,13301,3855,10489.0,5.25,https://cdn.myanimelist.net/images/anime/7/75891.jpg,https://myanimelist.net/anime/31491/Hantsu_x_Trash
30955,Crazy Monkey,Jackie Chan's 1979 film  The Fearless Hyena  opened in Japan a year later under the name  Crazy Monkey  accompanied with an independent original animated piece by Monkey Punch set to the insert song Monkey Man featuring characters that look similar to the cast of Lupin Sansei.,['Ecchi'],"Apr 19, 1980",1.0,343,11828,10485.0,5.25,https://cdn.myanimelist.net/images/anime/2/74487.jpg,https://myanimelist.net/anime/30955/Crazy_Monkey
5025,Dengeki Oshioki Musume Gootaman: Gootaman Tanjou-hen,"Mari Amachi is a very devout Christian who transfers to Perfect Religion Academy. A school devoted to all religions of the world in effort to make it's students the next world leaders in religion. Her friend Saori is kidnapped by the Black Buddha cult; a group who wishes to take away religious freedom though force and brainwashing. Mari prays to God for help but Buddha answers the call, instead! Mari aspires only to help her friend and she is transformed into Butt Attack Punisher Girl Gotaman. Between fighting bad guys, making a deal with Buddha, and wearing scandalous costumes, is it more than Mari can take? ","['Action', 'Comedy', 'Ecchi', 'Parody']","May 24, 1994",1.0,3486,6635,10441.0,5.27,https://cdn.myanimelist.net/images/anime/8/15386.jpg,https://myanimelist.net/anime/5025/Dengeki_Oshioki_Musume_Gootaman__Gootaman_Tanjou-hen
1596,Arcade Gamer Fubuki,"Fubuki Sakuragasaki is a powerful gamer who, with the power of her Passion Panties, climbs up the ranks of the BAG (Best of Arcade Gamer) tournament to become the greatest Arcade Gamer in the world. However, the evil Gulasic Group is out to conquer the world through said tournament, and their gaming skills will prove to be a challenge. Fubuki must team up with the legendary Mr. Mystery to combat the four Gods of Gaming and make the world of arcade gaming safe for all.  
 
(Source: ANN)","['Action', 'Comedy', 'Ecchi', 'Parody', 'Shounen', 'Sports', 'Super Power']","Feb 25, 2002 to Jan 25, 2003",4.0,4898,5797,10424.0,5.28,https://cdn.myanimelist.net/images/anime/2/5065.jpg,https://myanimelist.net/anime/1596/Arcade_Gamer_Fubuki
11209,Maken-Ki! OVA,OVA episodes bundled with the 8th and 11th volumes of the manga.,"['Action', 'Ecchi', 'Harem', 'Martial Arts', 'School', 'Super Power']","Mar 1, 2012 to Sep 25, 2013",2.0,39324,2219,4905.0,6.74,https://cdn.myanimelist.net/images/anime/7/36929.jpg,https://myanimelist.net/anime/11209/Maken-Ki_OVA
7148,Ladies versus Butlers!,"Hino Akiharu lost his parents when he was small and was adopted into his uncle's family. He didn't want to be a burden on his uncle's family and decides to enter a free boarding school as a butler, Hakureiryou high school. However, his delinquent boy-like appearance frightens the girls, who make up the majority of the students. Unable to get along with the classmates, Akiharu meets his childhood crush Saikyou Tomomi. ","['Harem', 'Comedy', 'Romance', 'Ecchi', 'School']","Jan 5, 2010 to Mar 23, 2010",12.0,146319,755,4901.0,6.74,https://cdn.myanimelist.net/images/anime/7/75252.jpg,https://myanimelist.net/anime/7148/Ladies_versus_Butlers
28071,Itsumo Kokoro ni Taiyou wo!,"Follows the story of the manga of the same name where a a high school boy finds a room for a boarding house that only costs 30,000 yen a month (about 300 USD). But there's a catch. ","['Comedy', 'Ecchi']","Nov 2, 1999 to Nov 26, 1999",16.0,493,11186,337.0,8.18,https://cdn.myanimelist.net/images/anime/11/67945.jpg,https://myanimelist.net/anime/28071/Itsumo_Kokoro_ni_Taiyou_wo
33661,Crayon Shin-chan Gaiden: Alien vs. Shinnosuke,"Unlike the main television anime series which is mostly set in modern-day Japan, the new series will be a ""sealed room"" suspense comedy set 100 years in the future. The story begins when Shinnosuke and the entire Nohara family wake up from cold sleep to find themselves aboard a space ship drifting in space. The anime will depict the various events that take place inside the ship. (Source: ANN)","['Sci-Fi', 'Space', 'Comedy', 'Ecchi', 'Seinen']","Aug 3, 2016 to Oct 26, 2016",13.0,1286,9002,4887.0,6.74,https://cdn.myanimelist.net/images/anime/4/80926.jpg,https://myanimelist.net/anime/33661/Crayon_Shin-chan_Gaiden__Alien_vs_Shinnosuke
1749,Amaenaide yo!!: Yasumanaide yo!!,"Ikko and the girls of Saienji Buddhist Temple are participating in a game show competition and happen to win a trip to a secluded inn. At the inn, Ikko is presented with the challenge of not awakening while all of the girls are sleepwalking.","['Ecchi', 'Comedy', 'Romance', 'Supernatural']","Dec 21, 2005",1.0,12541,3940,4881.0,6.74,https://cdn.myanimelist.net/images/anime/12/32069.jpg,https://myanimelist.net/anime/1749/Amaenaide_yo__Yasumanaide_yo
8889,Majo demo Steady,"Hisashi Seki, ordinary working guy, wakes up one morning to find a naked, and very amorous, girl in his bed. He's happy to take advantage of the situation, to their mutual satisfaction. However, the girl's appearance leads to all sorts of increasingly strange phenomenon. The cause lies, sort of, in Jungian psychology. The girl, whom he has named Asami, is from a parallel dimension where people's ideal partners - the anima to their animus, or vice versa - reside. Asami's longing has allowed her to cross dimensions to be with Seki, but her presence in his world upsets the natural order. She goes back, and Seki must venture to her world to save her. The lovers are reunited. However, matters don't turn out quite as they hoped. 
 
(Source: Orphan fansubs)","['Comedy', 'Magic', 'Romance', 'Ecchi']","Sep 5, 1986",1.0,600,10608,10374.0,5.31,https://cdn.myanimelist.net/images/anime/7/24678.jpg,https://myanimelist.net/anime/8889/Majo_demo_Steady
21215,Zettai Shougeki: Platonic Heart Picture Drama,Short picture drama specials included in BD/DVD volumes.,"['Action', 'Ecchi', 'Martial Arts']","Nov 27, 2008 to Feb 25, 2009",4.0,961,9611,10358.0,5.32,https://cdn.myanimelist.net/images/anime/2/56101.jpg,https://myanimelist.net/anime/21215/Zettai_Shougeki__Platonic_Heart_Picture_Drama
32603,Okusama ga Seitokaichou!+!,"The story begins with Izumi Hayato running to be student council president. But when a beautiful girl swings in promising the liberalization of love while flinging condoms into the audience, he ends up losing to her and becoming the vice president. At the student council meeting, the newly-elected president invites herself over to Izumi's house, where she promptly announces she is to become Izumi's wife thanks to an agreement—facilitated by alcohol—made between their parents when they were only 3. 
 
(Source: MAL Scanlations)","['Comedy', 'Romance', 'Ecchi', 'School', 'Shounen']","Oct 2, 2016 to Dec 18, 2016",12.0,98082,1120,4855.0,6.75,https://cdn.myanimelist.net/images/anime/8/82409.jpg,https://myanimelist.net/anime/32603/Okusama_ga_Seitokaichou_
34964,Killing Bites,"After unknowingly participating in a kidnapping, college student Yuuya Nomoto finds his friends brutally murdered by Hitomi Uzaki, the high school girl they attempted to abduct. Forced to drive her to an undisclosed location, he finds himself being wagered as the prize for a death match between two Therianthropes, superpowered human-animal hybrids created through advanced gene therapy. As one of these hybrids, Hitomi uses the speed and fearlessness she gained from her ratel genes to viciously dispatch her foe and save Yuuya from certain death. 
 
Waking up hours later hoping the whole event was only a nightmare, Yuuya realizes that he has become embroiled in a secret proxy war between four large Japanese business conglomerates, with the winner taking control of the economy. As her sole albeit unwilling investor, his life is now directly linked to Hitomi's ability to participate in underground bloodsport matches known only as Killing Bites. 
 
[Written by MAL Rewrite] 
","['Action', 'Ecchi', 'Sci-Fi', 'Seinen']","Jan 13, 2018 to Mar 31, 2018",12.0,100623,1095,4844.0,6.75,https://cdn.myanimelist.net/images/anime/13/90087.jpg,https://myanimelist.net/anime/34964/Killing_Bites
25689,Hyakka Ryouran: Samurai After,"OVA bundled with Niθ Art Works Vol. 2, featuring a new character named Kagekatsu Uesugi.","['Ecchi', 'Harem']","Jan 23, 2015 to Jul 1, 2015",2.0,15695,3610,4841.0,6.75,https://cdn.myanimelist.net/images/anime/6/73391.jpg,https://myanimelist.net/anime/25689/Hyakka_Ryouran__Samurai_After
30739,Ane Log: Moyako Neesan no Honpen wo Tobidashite Tomaranai Monologue Specials,"In addition to the flash anime, 3 short special episodes were included on the Ane Log Fan Disc. 
 
 Episodes 
#1: Sekai no Ane Ijin no Jikan 
#2: Moya-nee Boot Camp 
#3: Ane Denwa Soudan","['Comedy', 'Ecchi']","Apr 18, 2014",3.0,3239,6837,10324.0,5.33,https://cdn.myanimelist.net/images/anime/11/73851.jpg,https://myanimelist.net/anime/30739/Ane_Log__Moyako_Neesan_no_Honpen_wo_Tobidashite_Tomaranai_Monologue_Specials
16656,Zettai Junpaku♡Mahou Shoujo,Doujinshi anime Blu-ray Disc offered at the Comic Market 82 event on August 2012.,"['Action', 'Ecchi', 'Harem', 'Magic']","Aug 12, 2012",1.0,10284,4299,10282.0,5.36,https://cdn.myanimelist.net/images/anime/9/65213.jpg,https://myanimelist.net/anime/16656/Zettai_Junpaku%E2%99%A1Mahou_Shoujo
797,Hanaukyou Maid-tai OVA,"In this three-episode OVA, Taro learns more about Cynthia`s life as herself and her alter-ego Grace. He also undergoes training with his bodyguard Konoe. And finally, Ikuyo dupes Taro in spending a whole day disguised as a maid.   
 
(Source: ANN)","['Comedy', 'Ecchi', 'Harem', 'Romance']","Sep 19, 2001 to Nov 7, 2001",3.0,8139,4724,4838.0,6.75,https://cdn.myanimelist.net/images/anime/10/3800.jpg,https://myanimelist.net/anime/797/Hanaukyou_Maid-tai_OVA
38814,Nobunaga-sensei no Osanazuma,"""One day, a girl who loves me will suddenly appear before me""—Middle school teacher Nobunaga has always been dreaming of such a gal game-like situation. However, the one who appeared before him was Kichou, a 14-year-old girl who proclaims herself as his wife. Appears to have arrived from the Sengoku era, she mistakes Nobunaga as Nobunaga Oda and urges him to conceive a child with her. Thus begins the age-difference love comedy between a gal game-loving teacher and a Sengoku era expert princess. 
 
(Source: MAL News)","['Comedy', 'Ecchi', 'Harem', 'Romance', 'School']","Apr 6, 2019 to Jun 22, 2019",12.0,40322,2193,10203.0,5.39,https://cdn.myanimelist.net/images/anime/1524/97286.jpg,https://myanimelist.net/anime/38814/Nobunaga-sensei_no_Osanazuma
37320,Amai Choubatsu: Watashi wa Kanshu Senyou Pet,"Framed and sent to Kokuyoku Prison for embezzlement, Hina Saotome desperately wants to prove her innocence. However, just when she thought her situation couldn't get any worse, she realizes that she is the only woman in a prison populated by men. But she may have even more to fear from Aki Myojin, a handsome and stern warden who is intent on punishing her for an unknown reason. 
 
Although the warden's treatment is unconventional, Hina's body soon begins to long for Aki's particular brand of discipline. But has this hypnotizing man, who has captivated her body, captured her heart as well? 
 
[Written by MAL Rewrite]",['Ecchi'],"Apr 2, 2018 to Jun 25, 2018",13.0,14881,3683,10189.0,5.39,https://cdn.myanimelist.net/images/anime/1374/90580.jpg,https://myanimelist.net/anime/37320/Amai_Choubatsu__Watashi_wa_Kanshu_Senyou_Pet
7774,"Shin Koihime†Musou: Gunyuu, Minami no Shima de Bakansu wo Suru no Koto - Ato, Porori mo Aru yo!","The story takes place at St. Francesca Academy. After the battle between the students ended, they all go to a southern island.","['Comedy', 'Ecchi', 'Fantasy']","Jul 7, 2010",1.0,6584,5144,4812.0,6.76,https://cdn.myanimelist.net/images/anime/12/26692.jpg,https://myanimelist.net/anime/7774/Shin_Koihime%E2%80%A0Musou__Gunyuu_Minami_no_Shima_de_Bakansu_wo_Suru_no_Koto_-_Ato_Porori_mo_Aru_yo
11597,Nisemonogatari,"Surviving a vampire attack, meeting several girls plagued by supernatural entities, and just trying to get through life are some of the things high school student Koyomi Araragi has had to deal with lately. On top of all this, he wakes up one morning to find himself kidnapped and tied up by his girlfriend Hitagi Senjougahara. Having run afoul of Deishuu Kaiki, a swindler who conned Senjougahara's family, she has taken it upon herself to imprison Araragi to keep him safe from the con man. But when Araragi gets a frantic message from his sister Karen, he learns that the fraud has set his sights on her. 
 
Along with Karen's troubles, his other sister, Tsukihi, is having issues of her own. And when two mysterious women who seem to know more than they should about Araragi and his special group of friends step into their lives, not even he could anticipate their true goals, nor the catastrophic truths soon to be revealed. 
 
[Written by MAL Rewrite]","['Mystery', 'Comedy', 'Supernatural', 'Ecchi']","Jan 8, 2012 to Mar 18, 2012",11.0,455598,166,319.0,8.2,https://cdn.myanimelist.net/images/anime/1044/103654.jpg,https://myanimelist.net/anime/11597/Nisemonogatari
30600,Military! Special,Episode 13 included with the Blu-ray/DVD release. ,"['Military', 'Comedy', 'Ecchi']","Mar 20, 2015",1.0,3863,6383,10147.0,5.41,https://cdn.myanimelist.net/images/anime/7/73505.jpg,https://myanimelist.net/anime/30600/Military_Special
35559,Sin: Nanatsu no Taizai - Masani Akuma no Shogyou...,Recap of the first four episodes of  Sin: Nanatsu no Taizai .,"['Ecchi', 'Fantasy']","May 13, 2017",1.0,6616,5141,10119.0,5.42,https://cdn.myanimelist.net/images/anime/3/86622.jpg,https://myanimelist.net/anime/35559/Sin__Nanatsu_no_Taizai_-_Masani_Akuma_no_Shogyou
38212,"Shuudengo, Capsule Hotel de, Joushi ni Binetsu Tsutawaru Yoru.","The anime centers on Minori, an office worker, and her boss Hadano, who are constantly arguing with each other. One night, after a company drinking party, Minori and Hadano are having their usual argument, when Minori realizes that she has missed the last train. They decide to spend the night at a nearby capsule hotel, but an incident forces them to share the same unit.  
 
(Source: ANN)","['Ecchi', 'Josei', 'Romance']","Oct 8, 2018 to Dec 24, 2018",12.0,10389,4288,10118.0,5.42,https://cdn.myanimelist.net/images/anime/1418/93509.jpg,https://myanimelist.net/anime/38212/Shuudengo_Capsule_Hotel_de_Joushi_ni_Binetsu_Tsutawaru_Yoru
35629,Skirt no Naka wa Kedamono Deshita.,"Shizuka Kominami is a shy college student who, despite her bashful demeanor, attends a college mixer. There, she meets Ryou Kirishima, a beautiful, confident woman whom she quickly befriends. After leaving the mixer together, the two spend the night talking and drinking. But when an inebriated Shizuka ends up at Ryou's apartment, one thing leads to another, and she finds herself being seduced by her new friend. And what's more, Ryou is actually a crossdressing man! 
 
After a passion-filled night, Shizuka awakens to a note left by Ryou, promising more erotic moments between them later. How will Shizuka's newfound relationship with Ryou unfold? 
 
[Written by MAL Rewrite]","['Drama', 'Ecchi', 'Romance']","Jul 3, 2017 to Sep 18, 2017",12.0,36028,2317,10094.0,5.43,https://cdn.myanimelist.net/images/anime/4/86647.jpg,https://myanimelist.net/anime/35629/Skirt_no_Naka_wa_Kedamono_Deshita
32447,Nora to Oujo to Noraneko Heart,"Nora Handa is a boy who lives with Shachi Yuuri, who was adopted by his mother. With everyone supporting, the two of them grew up healthily even after their parents passed away. Shachi, who likes Nora the most, wakes him up every morning. 
 
Nora spends his happy student life with Michi Kuroki, who is a disciplinary committee, honor student at school and childhood friend of the main character, Yuuki Asuhara, who is a gal but is very bright and can talk his worries to, and more friends at school. 
 
One day, Nora meets a girl who calls herself Patricia at the park on the way to the school. Patricia is a queen at hell, and claims to come here to destroy the life on land. However, she is damaged heavily because she touched the life for the first time. The energy was stronger than her, so Nora needed to tend her. Patricia asked him to tell her about the mysteries of life, and he had to even explain the ero book that he found at the park...?! 
 
(Source: Amazon Japan)","['Comedy', 'Ecchi']","Jul 12, 2017 to Sep 27, 2017",11.0,33254,2420,10091.0,5.43,https://cdn.myanimelist.net/images/anime/3/85868.jpg,https://myanimelist.net/anime/32447/Nora_to_Oujo_to_Noraneko_Heart
10578,C³,"From the light novel series written by Minase Hazuki, comes a story of love, action, and comedy. Yachi Haruaki is a high school boy who is naturally resistant to curses. After his father sends him a mysterious black cube, Haruaki awakes to find a nude girl named Fear standing in his kitchen. She’s the human form of the cursed black cube – and an instrument of torture! Utilizing her special abilities, Fear fights alongside Haruaki to defeat other cursed instruments and their owners. 
 
(Source: FUNimation)","['Action', 'Comedy', 'Ecchi', 'School', 'Supernatural']","Oct 1, 2011 to Dec 17, 2011",12.0,142071,780,4884.0,6.74,https://cdn.myanimelist.net/images/anime/13/32285.jpg,https://myanimelist.net/anime/10578/C%C2%B3
6166,Asobi ni Iku yo!,"Kio is just another boring, nice guy with a boring, nice life until he meets a beautiful, curvaceous cat-girl while attending a memorial service for one of his ancestors. Next thing he knows, he's lying in bed with this half-naked beauty next to him! Her name is Eris, and she has come to Earth to learn more about its inhabitants as a representative of the planet Catian. And she's decided to set up shop at Kio's home for her stay on Earth! 
 
Unbeknownst to Kio, there are quite a few organizations who will attempt to capture Eris, looking to keep her existence a secret by any means necessary. What's worse is when people around Kio turn out to secretly be a part of those organizations! Kio will have to work hard to keep Eris safe from these shady groups. Things are about to get mysterious, exciting, and most importantly sexy in  Asobi ni Iku yo!","['Comedy', 'Ecchi', 'Harem', 'Romance', 'Sci-Fi']","Jul 11, 2010 to Sep 26, 2010",12.0,142152,778,4882.0,6.74,https://cdn.myanimelist.net/images/anime/7/75583.jpg,https://myanimelist.net/anime/6166/Asobi_ni_Iku_yo
9499,Dokushin Apartment Dokudami-sou,Based on the manga by Takashi Fukutani.,"['Slice of Life', 'Comedy', 'Ecchi', 'Seinen']","Dec 1, 1989 to Apr 1, 1990",3.0,672,10328,10057.0,5.41,https://cdn.myanimelist.net/images/anime/3/26386.jpg,https://myanimelist.net/anime/9499/Dokushin_Apartment_Dokudami-sou
2384,Yakusai Kochou,"Spirits begin terrorizing a school and it is left up to the sexy student Kocho Enoki to use her attractive body and magical powers to defeat the attackers. Teamed with her sister and Kosaku, their human decoy, they attempt to free the school from the spirits. Unfortunately a female spirit arrives who is immune to Kocho's sexy charms.  
 
(Source: ANN)","['Comedy', 'Supernatural', 'Ecchi']","May 21, 1997",1.0,1630,8415,10019.0,5.46,https://cdn.myanimelist.net/images/anime/2/22356.jpg,https://myanimelist.net/anime/2384/Yakusai_Kochou
1627,Choushin Hime Dangaizer 3,"10,000 years ago, acting as judge, jury and executioner, Dangaizer sealed the fate of mankind by reducing it to ashes. Slowly, mankind rebuilt their civilization and once again stands at its peak. Hiding amongst the survivors of mankind, the evil organization of Goma lies in wait for the return of Dangaizer. This time, it’s a race to stop the awakening of the 3 that can pilot Dangaizer and subjugate the world to their rule. Will the 3rd pilot learn her true destiny and awaken in time, or will the world find a new destiny in the hands of Goma? 
 
(Source: AniDB)","['Adventure', 'Ecchi', 'Mecha', 'Sci-Fi']","Oct 8, 1999 to Mar 23, 2001",4.0,1434,8734,9988.0,5.46,https://cdn.myanimelist.net/images/anime/2/15185.jpg,https://myanimelist.net/anime/1627/Choushin_Hime_Dangaizer_3
2790,Oira Sukeban,"Does being the only guy in an all girl school sound like paradise? It might be, if the girls knew you were a guy, but to stay in school teenage pervert Banji can't let can't let anyone find out his chromosomes don't match. Banji's status conscious parents want him to go to a good school, but not enough to spend the money on a good co-ed school. Now, in addition to studying math and science, Banji has to learn how to put on a bra and makeup. His life has become a living hell. Not only is he at the bottom of the social pecking order, he must also got to conceal his inner-masculinity from the pretty classmate girl who's stolen his heart while avoiding the female bullies who threaten to expose his less-than-feminine charms in the locker room. 
 
(Source: ANN) 
","['Comedy', 'Ecchi', 'School']","Aug 21, 1992",1.0,1418,8760,10245.0,5.37,https://cdn.myanimelist.net/images/anime/2/54629.jpg,https://myanimelist.net/anime/2790/Oira_Sukeban
30782,Bikini Warriors,"When darkness threatens the world, four heroines hold the only hope for salvation—if they can even manage to get out of the first town, that is.  Bikini Warriors  follows a party of beautiful adventurers in revealing armor: courageous Fighter, airheaded Paladin, timid Mage, and alluring Darkelf. But can you really be an adventurer if you don't get going on an adventure? 
 
Our heroines are eternally broke, insufferably vain, and frequently outmatched by the dangers of their world. Between fleeing dungeons and robbing peasants, the unlikely heroes will have to learn to live with each other before they can survive a battle with ultimate evil!","['Comedy', 'Ecchi', 'Fantasy', 'Parody']","Jul 8, 2015 to Sep 23, 2015",12.0,57716,1722,10457.0,5.26,https://cdn.myanimelist.net/images/anime/12/75103.jpg,https://myanimelist.net/anime/30782/Bikini_Warriors
36847,Nanatsu no Bitoku,"Set in the same timeline as  Sin: Nanatsu no Taizai ,  Nanatsu no Bitoku  follows a group of angels sent from Heaven to look for a potential ""Savior"" to counter-attack the demonic influence being spread by Lucifer and the other emissaries of Hell. 
 
(Source: Tokyo Zerostar)","['Ecchi', 'Fantasy']","Jan 27, 2018 to Mar 31, 2018",10.0,32503,2456,10496.0,5.25,https://cdn.myanimelist.net/images/anime/9/89129.jpg,https://myanimelist.net/anime/36847/Nanatsu_no_Bitoku
9515,Highschool of the Dead: Drifters of the Dead,"An OVA of Highschool of the Dead bundled with the 7th manga volume. 
 
Komuro and the gang stumble upon a deserted tropical island that looks to be free of zombies. They make use of this wonderful opportunity and dress up in skimpy swimsuits and have lots and lots of fanservice fun. 
 
Hallucinogenic substances are involved.","['Ecchi', 'Comedy', 'Supernatural']","Apr 26, 2011",1.0,207083,524,4994.0,6.72,https://cdn.myanimelist.net/images/anime/1746/97780.jpg,https://myanimelist.net/anime/9515/Highschool_of_the_Dead__Drifters_of_the_Dead
18247,IS: Infinite Stratos 2,Second season of  Infinite Stratos .,"['Action', 'Sci-Fi', 'Harem', 'Comedy', 'Ecchi', 'Mecha']","Oct 4, 2013 to Dec 20, 2013",12.0,246622,409,4996.0,6.72,https://cdn.myanimelist.net/images/anime/12/49359.jpg,https://myanimelist.net/anime/18247/IS__Infinite_Stratos_2
9506,Prism Magical: Prism Generations!,"* An exclusive OVA produced for PAJAMAS SOFT 10th Anniversary-Project Prism Magical: Prism Generations! and included with the professional package of the game. 
 
There is a small town on the sea. Raika just enjoys his school life with Ibuki, his old friend, and Yuri, his maid. However, his father is actually a magical girl (?). Also, a group of magical girls come to his school to look for a treasure stone called Mana Prism. Though he doesn't want to wear a girl's costume, he is forced to be a magical girl as well! ""Come back, my peaceful life!"" To save his school, his battle against the magical girls starts now!  
 
(Source: AniDB)","['Comedy', 'Ecchi', 'Magic']","Aug 27, 2010",1.0,2308,7604,10740.0,5.12,https://cdn.myanimelist.net/images/anime/2/26282.jpg,https://myanimelist.net/anime/9506/Prism_Magical__Prism_Generations
