uid,title,synopsis,genre,aired,episodes,members,popularity,ranked,score,img_url,link
11499,Sankarea,"Ever since he was a child, zombie-obsessed Chihiro Furuya has wanted an undead girlfriend. Soon enough, his love for all things zombie comes in handy when his cat Baabu gets run over, prompting Chihiro to try to make a resurrection potion and bring him back to life. During his endeavor, he sees a rich girl named Rea Sanka yelling into an old well every day about her oppressive life. After meeting and bonding with her, Chihiro is convinced by Rea to persevere in saving Baabu. Eventually, he succeeds with the help of the poisonous hydrangea flowers from Rea's family garden. 
 
Unaware of the potion's success and seeking to escape the burdens of her life, Rea drinks the resurrection potion, mistakenly thinking she will die. Though it doesn't kill her, the effects still linger and her death from a fatal accident causes her to be reborn as a zombie. With help from Chihiro, Rea strives to adjust to her new—albeit undead—life.  
 
For a boy wanting a zombie girlfriend, this situation would seem like a dream come true. But in  Sankarea , Chihiro's life becomes stranger than usual as he deals with Rea's odd new cravings and the unforeseen consequences of her transformation. 
 
[Written by MAL Rewrite]","['Comedy', 'Ecchi', 'Horror', 'Romance', 'Shounen', 'Supernatural']","Apr 6, 2012 to Jun 29, 2012",12.0,378403,237,1917.0,7.45,https://cdn.myanimelist.net/images/anime/1487/95651.jpg,https://myanimelist.net/anime/11499/Sankarea
29165,Daitoshokan no Hitsujikai Picture Drama,"Picture Drama episodes bundled with the Blu-ray/DVD Volumes.  
 
Sakuraba tries to draw Shirasaki, and things take a turn for the ecchi.","['Ecchi', 'Comedy']","Dec 25, 2014 to May 28, 2015",6.0,4870,5823,6639.0,6.38,https://cdn.myanimelist.net/images/anime/6/70145.jpg,https://myanimelist.net/anime/29165/Daitoshokan_no_Hitsujikai_Picture_Drama
28149,Nihon Animator Mihonichi,"Nihon Animator Mihonichi  is a collaborative series of standalone anime shorts with the support of various directors and studios. Aiming to expose new animators to a worldwide audience, these small works offer a glimpse into the future of the industry, featuring rising talents, cutting-edge techniques, and experimental aesthetic designs. 
 
[Written by MAL Rewrite]","['Action', 'Dementia', 'Ecchi', 'Fantasy', 'Mecha', 'Military', 'Music', 'School', 'Sci-Fi', 'Space', 'Supernatural']","Nov 7, 2014 to Oct 9, 2015",35.0,27921,2679,1911.0,7.45,https://cdn.myanimelist.net/images/anime/11/71901.jpg,https://myanimelist.net/anime/28149/Nihon_Animator_Mihonichi
34277,"New Game!: Watashi, Shain Ryokou tte Hajimete nano de...","The staff of Eagle Jump take a long awaited vacation to a ski resort, celebrating the release of their latest iteration of the 'Fairies Story' game. Being her first company trip, Aoba Suzukaze is excited for it, but is also apprehensive as she has no prior skiing experience. Join Aoba and her colleagues as they de-stress and enjoy their time at the resort. 
 
[Written by MAL Rewrite]","['Comedy', 'Ecchi', 'Slice of Life']","May 3, 2017",1.0,50150,1896,1910.0,7.45,https://cdn.myanimelist.net/images/anime/10/86507.jpg,https://myanimelist.net/anime/34277/New_Game__Watashi_Shain_Ryokou_tte_Hajimete_nano_de
9181,Motto To LOVE-Ru,"Rito Yuuki never gets a break—he's always finding himself in lewd accidents with girls around him. Although his heart still yearns for Haruna, his childhood love, Rito can't help but question his feelings for Lala, the alien princess who appeared in front of him and declared she would marry him. But now, it's not just Lala he has to deal with: her younger twin sisters, Momo and Nana, have also travelled to Earth, wanting to meet their older sister’s fiancé, and just as luck would have it, they end up staying at Rito's home. 
 
Meanwhile, amidst the bustle of his new family members, Yami, the human weapon girl, begins her pursuit for Rito. It's not an easy life for Rito as he deals with uncertain love, punishment for being a pervert, and a girl dead set on murdering him. 
 
[Written by MAL Rewrite]","['Sci-Fi', 'Harem', 'Comedy', 'Ecchi', 'School', 'Shounen']","Oct 6, 2010 to Dec 22, 2010",12.0,215772,499,1909.0,7.45,https://cdn.myanimelist.net/images/anime/4/59875.jpg,https://myanimelist.net/anime/9181/Motto_To_LOVE-Ru
3884,Maze☆Bakunetsu Jikuu: Hot Springs,This is the missing Hot Springs episode included in the unrated boxset of Maze: Mega-Burst Space.,"['Action', 'Comedy', 'Ecchi', 'Fantasy']","Oct 23, 2004",1.0,897,9734,6559.0,6.4,https://cdn.myanimelist.net/images/anime/7/6943.jpg,https://myanimelist.net/anime/3884/Maze%E2%98%86Bakunetsu_Jikuu__Hot_Springs
32503,"Kemeko Deluxe!: Izumi-chan, Fukenkou yo! (Kari)",Short special bundled with Blu-ray/DVD volume 1.,['Ecchi'],"Dec 26, 2008",1.0,954,9627,6552.0,6.4,https://cdn.myanimelist.net/images/anime/9/78037.jpg,https://myanimelist.net/anime/32503/Kemeko_Deluxe__Izumi-chan_Fukenkou_yo_Kari
14889,Ebiten: Kouritsu Ebisugawa Koukou Tenmonbu OVA,Blu-ray disc bundled with the fourth volume of the manga.,"['Comedy', 'Ecchi', 'Parody', 'School', 'Shounen']","Jan 26, 2013",1.0,4570,5970,6539.0,6.4,https://cdn.myanimelist.net/images/anime/10/40905.jpg,https://myanimelist.net/anime/14889/Ebiten__Kouritsu_Ebisugawa_Koukou_Tenmonbu_OVA
35712,Boku no Kanojo ga Majimesugiru Sho-bitch na Ken,"Haruka Shinozaki has been interested in the class representative, Akiho Kousaka, since his first year in high school. She is attractive, good at sports, and is an all-around model student. Since they are in the same class this year, Shinozaki decides to confess his feelings—and, to his shock, Kousaka agrees to be his girlfriend! 
 
However, he finds that Kousaka is a bit stranger than he first thought: this seemingly perfect girl has never been in a relationship. But even though she is inexperienced, she vows to please Shinozaki in every way she can... such as learning multiple sex positions or his fetishes. Shinozaki tries to assure her that her studies into such subjects aren't necessary, but Kousaka devotes herself to making him happy in more ways than one. 
 
[Written by MAL Rewrite]","['Harem', 'Comedy', 'Romance', 'Ecchi', 'School']","Oct 12, 2017 to Dec 14, 2017",10.0,135010,838,6530.0,6.4,https://cdn.myanimelist.net/images/anime/12/87623.jpg,https://myanimelist.net/anime/35712/Boku_no_Kanojo_ga_Majimesugiru_Sho-bitch_na_Ken
32282,Shokugeki no Souma: Ni no Sara,"The qualifiers of the Autumn Elections are now over, and only eight talented chefs remain. Now, they face off in one-on-one food wars, each with their own unique themes. Met with both new judges and new opponents all with their own specialties, Souma must stay on his toes if he hopes to make it to the top of both the Autumn Elections and Tootsuki Culinary Academy. 
 
[Written by MAL Rewrite]","['Ecchi', 'School', 'Shounen']","Jul 2, 2016 to Sep 24, 2016",13.0,562262,107,171.0,8.38,https://cdn.myanimelist.net/images/anime/8/79353.jpg,https://myanimelist.net/anime/32282/Shokugeki_no_Souma__Ni_no_Sara
1903,Stratos 4: Logbook,Stratos 4 Recap episode - For everything which happened before Stratos 4 Advance started.,"['Action', 'Ecchi', 'Sci-Fi']","Aug 26, 2006",1.0,1365,8855,6523.0,6.41,https://cdn.myanimelist.net/images/anime/5/8374.jpg,https://myanimelist.net/anime/1903/Stratos_4__Logbook
15119,Senran Kagura,"The Hanzo Academy is a prestigious prep school with a secret known only to a select few. Behind its walls is a training course for shinobi; trained spies and assassins that centuries ago had served the shoguns for their political and military needs. Today the tradition continues with five young female trainees with diverse personalities: the care-free Asuka, fierce yet perverted Katsuragi, the sweet and innocent Hibari, stoic and protective Yagyuu, and their mature, class representative, Ikaruga. 
 
 Senran Kagura  tells the story of these five girls and their secret journey to complete their shinobi training. The journey quickly becomes more complicated than they expect though when a darker, more sinister group of shinobi reveal themselves. Not only do they know of the girls at the Hanzo Academy, but they seem fully intent on and capable of proving themselves to be the superior, modern day shinobi. 
 
Through honing their skills, harnessing the power of their secret scrolls to perform shinobi transformations, and working together as a team, Asuka and her friends must rise to meet this new challenge. Not just for the sake of their training, but for the everything the Hanzo Academy stands for.","['Action', 'Comedy', 'Ecchi', 'School']","Jan 6, 2013 to Mar 24, 2013",12.0,94942,1156,6519.0,6.41,https://cdn.myanimelist.net/images/anime/5/45640.jpg,https://myanimelist.net/anime/15119/Senran_Kagura
11859,Queen's Blade: Rebellion,"Power corrupts, and it when it appears that the once noble Queen Claudette's ways have turned to oppression and heretical persecution, it's up to a new generation of warriors to step up to the plate armor to bear arms and bare their naked fury in open rebellion! The odds may seem unfairly stacked in favor of the Amazonian ranks of the queen, doubly supported by her power of writ and assassins. But the incredible wits and assets of the dazzling array of daring damsels willing to risk their gorgeous skins and put their lithesome bodies on line against her, might just expose a few unexpected weaknesses in the queen's support!  
 
(Source: Sentai Filmworks) ","['Action', 'Adventure', 'Ecchi', 'Fantasy']","Apr 3, 2012 to Jun 19, 2012",12.0,31423,2503,6513.0,6.41,https://cdn.myanimelist.net/images/anime/6/75502.jpg,https://myanimelist.net/anime/11859/Queens_Blade__Rebellion
39463,Gleipnir,"Kagaya Shuuichi is an ordinary high school kid in a boring little town. But when a beautiful classmate is caught in a warehouse fire, he discovers a mysterious power: he can transform into a furry dog with an oversized revolver and a zipper down his back. He saves the girl's life, sharing his secret with her. But she's searching for the sister who killed her family, and she doesn't care how degrading it gets: she will use Shuuichi to accomplish her mission... 
 
(Source: Kodansha Comics)","['Action', 'Mystery', 'Supernatural', 'Ecchi', 'Seinen']","Apr, 2020 to ?",,6456,5754,,,https://cdn.myanimelist.net/images/anime/1424/99660.jpg,https://myanimelist.net/anime/39463/Gleipnir
38425,Ikkitousen: Western Wolves,,"['Action', 'Ecchi', 'Martial Arts', 'School', 'Seinen', 'Super Power']","Jan 3, 2019 to Feb 27, 2019",3.0,6212,5294,6389.0,6.43,https://cdn.myanimelist.net/images/anime/1914/95106.jpg,https://myanimelist.net/anime/38425/Ikkitousen__Western_Wolves
769,Burn Up! W,"When crime and terrorism go out of control in Tokyo, the police unleash Team Warrior - a band of highly-skilled and completely reckless band of female cops. Featuring loose cannon Rio, triggerhappy Maya and ace hacker Lilica, Team Warrior will get the job done, regardless of the budget of the mission.  
 
(Source: ANN) 
","['Sci-Fi', 'Comedy', 'Ecchi', 'Mecha', 'Shounen']","Apr 10, 1996 to Sep 26, 1996",4.0,7560,4852,6379.0,6.43,https://cdn.myanimelist.net/images/anime/1805/96595.jpg,https://myanimelist.net/anime/769/Burn_Up_W
10924,Queen's Blade OVA,"OVAs bundled with the Queen's Blade Premium Visual Book and the Queen's Blade Rebellion Premium Visual Book. Both of the episodes will be based on Queen's Blade Rebellion, a sequel to Queen's Blade: Utsukushiki Toushitachi.","['Action', 'Adventure', 'Ecchi', 'Fantasy']","Oct 29, 2011 to Jan 28, 2012",2.0,12605,3935,6359.0,6.44,https://cdn.myanimelist.net/images/anime/3/30145.jpg,https://myanimelist.net/anime/10924/Queens_Blade_OVA
5056,Penguin Musume♥Heart Special,ONA Special episode #11.5. ,"['Comedy', 'Ecchi', 'School', 'Slice of Life']","Aug 1, 2008",1.0,3013,6997,6356.0,6.44,https://cdn.myanimelist.net/images/anime/13/30423.jpg,https://myanimelist.net/anime/5056/Penguin_Musume%E2%99%A5Heart_Special
382,Futari Ecchi,"Makoto and Yura Onoda are a newly-wed couple with zero sexual experience. Yura is a shy and naive 25-year-old woman whose good looks grab men's attention, something that she dislikes because she gets embarrassed very easily. Her husband Makoto is of the same age, but as opposed to his wife, he loves having dirty thoughts about other women. Physically though, Makoto is truly faithful to Yura. 
 
Both of them may be virgins, but now that they are married, they are ready to dive into the world of sex, ""practicing"" as often as possible. However, the world of sex is complex, so they need all the help they can get to find their way through it. Thankfully, their friends, acquaintances, and porn media lend them a helping hand.","['Comedy', 'Ecchi', 'Romance', 'Seinen', 'Slice of Life']","Jul 26, 2002 to Jan 22, 2004",4.0,26681,2739,6336.0,6.44,https://cdn.myanimelist.net/images/anime/10/20029.jpg,https://myanimelist.net/anime/382/Futari_Ecchi
374,Bannou Bunka Neko-Musume DASH!,"It's in the not too distant future. One day Nuku-Nuku dropped in and began to live with the Natsume family. Having lost her memory, Nuku-Nuku assumed the identity of a beautiful girl named Atsuko Higuchi. She was so beautiful and gentle, and besides, she was such a great cook that Ryunosuke, 14, was all smiles. However, after her arrival in town, a series of mysterious incidents started to happen in Maneki City - Experimental machines running haywire, roaring fighter aircraft flying low, mass destruction in the city. In every case, a mysterious girl was spotted at the scene of the incident. 
 
(Source: AnimeNfo)","['Action', 'Comedy', 'Ecchi', 'Romance', 'Sci-Fi']","Sep 23, 1998 to Dec 23, 1998",12.0,4358,6067,6329.0,6.44,https://cdn.myanimelist.net/images/anime/7/2886.jpg,https://myanimelist.net/anime/374/Bannou_Bunka_Neko-Musume_DASH
23309,Rail Wars!,"Rail Wars!  takes place in an alternate universe where the Japanese government remains in control of the nation's railway systems. Because of the stability afforded by the leadership of the government, the railway system is allowed to flourish. 
 
Naoto Takayama aspires to become an employee for Japan National Railways because of the comfortable life that it will enable him to live. In order to accomplish this he enters its training program, where students must demonstrate their knowledge of trains as well as their ability to be ready for any challenge that might arise. 
 
During this time period he will encounter other students such as the athletically gifted Aoi Sakura, the constantly hungry Sho Iwaizumi, and the human encyclopedia Haruka Komi. Together they will work towards surviving their trainee period, all the while taking on purse snatchers, bomb threats, and the looming specter of the extremist “RJ” group who wants to privatize the railway system.","['Action', 'Harem', 'Police', 'Ecchi']","Jul 4, 2014 to Sep 19, 2014",12.0,135279,833,6312.0,6.45,https://cdn.myanimelist.net/images/anime/13/65671.jpg,https://myanimelist.net/anime/23309/Rail_Wars
8861,"Yosuga no Sora: In Solitude, Where We Are Least Alone.","Haruka and Sora Kasugano are coming home, to a place filled with memories. 
 
Having lost their parents in a tragic car accident, the twins resolve to return to the countryside and start life anew at their grandfather's house, the haunt a constant reminder of moments from their past. Greeting them are childhood friends Nao Yorihime and  Akira Amatsume, and newcomer Kazuha Migiwa. It is a warm welcome, symbolic of the days that should come. 
 
Their peace is merely ephemeral, however, as suppressed emotions, born from vows both newfound and forgotten, start exerting their influence on the twins' new lives. And deep down, a dark secret, only known to them, begins to unshackle. 
 
Based on the visual novel by Sphere,  Yosuga no Sora  not only explores the power of lost memories and true love when the bonds of many become intertwined, but also raises the questions of morality and social acceptance. 
 
[Written by MAL Rewrite]","['Drama', 'Ecchi', 'Harem', 'Romance']","Oct 4, 2010 to Dec 20, 2010",12.0,288754,335,6285.0,6.45,https://cdn.myanimelist.net/images/anime/5/76216.jpg,https://myanimelist.net/anime/8861/Yosuga_no_Sora__In_Solitude_Where_We_Are_Least_Alone
3417,Yawaraka Sangokushi Tsukisase!! Ryofuko-chan,"Ryofu Housen (Lu Bu) is a powerful general from the Three Kingdoms; alongside Chinkyuu (Chen Gong), Ryofu suddenly finds himself falling to Earth, and landing... in the body of an elementary school student?! With their new lives as flat-chested, women-loving children, Ryofu and Chinkyuu follow their hunger and their desire to get back to their old lives somehow; but it will be difficult, given the variety of obstacles in their way including old enemies, epic monster battles and the most important thing of all, trying to get their hands on Eri-sensei's mammoth F-cup breasts! 
","['Comedy', 'Ecchi', 'Magic']","Dec 26, 2007 to Mar 26, 2008",4.0,4356,6071,6284.0,6.46,https://cdn.myanimelist.net/images/anime/2/25313.jpg,https://myanimelist.net/anime/3417/Yawaraka_Sangokushi_Tsukisase_Ryofuko-chan
10739,Panty & Stocking in Sanitarybox,A special short included with the 5th DVD/BD release.,"['Action', 'Comedy', 'Parody', 'Dementia', 'Supernatural', 'Ecchi']","Apr 28, 2011",1.0,28043,2667,6272.0,6.46,https://cdn.myanimelist.net/images/anime/6/29589.jpg,https://myanimelist.net/anime/10739/Panty___Stocking_in_Sanitarybox
39470,Tsugumomo OVA,,"['Action', 'Comedy', 'Supernatural', 'Ecchi', 'School', 'Seinen']","Jan 22, 2020",,5336,5606,,,https://cdn.myanimelist.net/images/anime/1053/99618.jpg,https://myanimelist.net/anime/39470/Tsugumomo_OVA
39469,Tsugu Tsugumomo,Second season of  Tsugumomo .,"['Action', 'Comedy', 'Ecchi', 'School', 'Seinen', 'Supernatural']","Apr, 2020 to ?",,8304,4773,,,https://cdn.myanimelist.net/images/anime/1885/104633.jpg,https://myanimelist.net/anime/39469/Tsugu_Tsugumomo
38005,Strike Witches: Road to Berlin,,"['Action', 'Ecchi', 'Magic', 'Military', 'Sci-Fi']",2020 to ?,,3976,6333,,,https://cdn.myanimelist.net/images/anime/1379/101518.jpg,https://myanimelist.net/anime/38005/Strike_Witches__Road_to_Berlin
40486,Strike the Blood: Kieta Seisou-hen,,"['Action', 'Supernatural', 'Ecchi', 'Vampire', 'Fantasy']","Jan 29, 2020",1.0,2864,7126,,,https://cdn.myanimelist.net/images/anime/1918/103377.jpg,https://myanimelist.net/anime/40486/Strike_the_Blood__Kieta_Seisou-hen
40485,Strike the Blood IV,,"['Action', 'Supernatural', 'Ecchi', 'Vampire', 'Fantasy']","Apr 8, 2020 to ?",12.0,10569,4331,,,https://cdn.myanimelist.net/images/anime/1290/103427.jpg,https://myanimelist.net/anime/40485/Strike_the_Blood_IV
40902,Shokugeki no Souma: Gou no Sara,"Fifth season of  Shokugeki no Souma . 
 
","['Ecchi', 'School', 'Shounen']","Apr, 2020 to ?",,31394,16335,,,https://cdn.myanimelist.net/images/anime/1335/104967.jpg,https://myanimelist.net/anime/40902/Shokugeki_no_Souma__Gou_no_Sara
40436,Peter Grill to Kenja no Jikan,"Peter Grill is known throughout the land as the world's strongest fighter. He has a girlfriend who he's steadily trying to get closer with. Life is good for him. Until he realizes that dozens of women, who want to bear strong children, are all vying for his seed. 
 
(Source: LHTranslation)","['Harem', 'Comedy', 'Ecchi', 'Fantasy']",Not available,,1198,9363,,,https://cdn.myanimelist.net/images/anime/1334/103228.jpg,https://myanimelist.net/anime/40436/Peter_Grill_to_Kenja_no_Jikan
40746,Overflow,"""Brother, are we really taking a bath together?"" 
 
And so, a forbidden bathing experience began. Me, my sister, and childhood friend—one man and two women—are sharing one bath. After involuntarily ""overflowing,"" the sister's secret love come out?! 
 
This is a young romantic comedy that won't let you say, ""it's over!"" 
 
(Source: Official site) 
 
Note:  The standard TV version of the anime will debut on January 6 at 1:00 a.m. on Tokyo MX, while the complete version will stream on the ComicFesta Anime Zone website. 
 
This entry reflects standard TV version of the anime.","['Romance', 'Ecchi']","Jan 6, 2020 to ?",,8549,4701,,,https://cdn.myanimelist.net/images/anime/1781/104461.jpg,https://myanimelist.net/anime/40746/Overflow
40708,Monster Musume no Oishasan,"In the town of Lindworm where monsters and humans coexist, Dr. Glenn runs an exemplary medical clinic for monster girls with his lamia assistant, Sapphee. Whether receiving a marriage proposal by a centaur injured in battle, palpating the injury of a mermaid, or suturing the delicate wounds of a flesh golem, Dr. Glenn performs his job with grace and confidence. But when an unsavory character seeks to steal a harpy egg, how will the unflappable Dr. Glenn respond...? 
  
(Source: Seven Seas Entertainment)","['Comedy', 'Romance', 'Ecchi', 'Fantasy']",2020 to ?,,1866,8659,,,https://cdn.myanimelist.net/images/anime/1644/104347.jpg,https://myanimelist.net/anime/40708/Monster_Musume_no_Oishasan
40750,Kaifuku Jutsushi no Yarinaoshi,"""Healing magicians cannot fight alone."" 
 
Keare, who was bound by this common knowledge, was exploited again and again by others. One day, he noticed what lay beyond healing magic, and was convinced that a healing magician was the strongest class. However, by the time he realized that potential, he was deprived of everything. Thus, he used healing magic on the world itself to go back four years, deciding to redo everything. 
 
This is a heroic tale of one healing magician who became the strongest by using knowledge from his past life and healing magic.  
 
(Source: Novel Updates, edited)","['Ecchi', 'Fantasy']",Not available,,4489,6517,,,https://cdn.myanimelist.net/images/anime/1076/104444.jpg,https://myanimelist.net/anime/40750/Kaifuku_Jutsushi_no_Yarinaoshi
35252,Hatena☆Illusion,"Ever since watching a magic show held by him and his wife Maeve, Makoto Shiranui has always admired Mamoru Hoshisato—a world-class magician, as well as friend of his parents—and came to Tokyo to become his apprentice. Kana, nicknamed Hatena, is the couple's daughter and his childhood friend. As the hustle and bustle activities in Tokyo catches Makoto off guard such as burglaries by a beautiful thief, he depends on Hatena's comforting side. When he came to Hoshisato's now-haunted mansion to reunite with his childhood friend, he is greeted by the family's butler and maid, Jeeves and Emma along with Hatena, only to discover that they are not as compatible anymore. 
 
(Source: MAL News)","['Comedy', 'Supernatural', 'Romance', 'Ecchi']","Jan 9, 2020 to ?",,7222,4991,,,https://cdn.myanimelist.net/images/anime/1075/104854.jpg,https://myanimelist.net/anime/35252/Hatena%E2%98%86Illusion
38853,Ex-Arm,"2014: Akira Natsume seems to almost have a phobia of electrical devices while also being very good at diagnosing them. He resolves to change himself for the better and get a girlfriend like his older brother did. ...But then Akira suddenly dies in an accident. 16 years later a special policewoman and her android partner retrieve and activate a highly advanced AI and superweapon called EX-ARM and put it into full control of their ship as a last resort. Turns out the AI is actually just Akira's brain! 
 
(Source: MU)","['Action', 'Sci-Fi', 'Ecchi', 'Seinen']","Jul, 2020 to ?",,2031,8152,,,https://cdn.myanimelist.net/images/anime/1138/97621.jpg,https://myanimelist.net/anime/38853/Ex-Arm
40453,Dungeon ni Deai wo Motomeru no wa Machigatteiru Darou ka II OVA,,"['Adventure', 'Comedy', 'Romance', 'Ecchi', 'Fantasy']","Jan 29, 2020",1.0,14742,3710,,,https://cdn.myanimelist.net/images/anime/1145/103302.jpg,https://myanimelist.net/anime/40453/Dungeon_ni_Deai_wo_Motomeru_no_wa_Machigatteiru_Darou_ka_II_OVA
5234,Zettai Yareru Greece Shinwa,"Comedy show based on Greek myths about how perverted the gods are. 
","['Comedy', 'Ecchi']","Oct 4, 2008 to Dec 27, 2008",13.0,472,11121,14622.0,5.77,https://cdn.myanimelist.net/images/anime/3/53619.jpg,https://myanimelist.net/anime/5234/Zettai_Yareru_Greece_Shinwa
2367,Moetan,"Ink Nijihara is a girl in high school. Unfortunately her crush Nao Tezuka barely recognizes her. To make matters worse, she is very short. Now Ink meets a duck and becomes a ""mahou shoujo"" and teaches Nao english in disguise.  
 
(Source: ANN)","['Comedy', 'Ecchi', 'Magic', 'School']","Jul 9, 2007 to Sep 24, 2007",12.0,23594,2935,6225.0,6.47,https://cdn.myanimelist.net/images/anime/4/21540.jpg,https://myanimelist.net/anime/2367/Moetan
40623,Dokyuu Hentai HxEros,"In a world on the verge of a great disaster that began five years ago, heroes who, with the help of a device called HxEros, use the power of Ecchi (H) and erotic power (Ero) to save the planet from libido-devouring monsters! 
 
Enjou Retto and Hoshino Kirara are childhood friends who have drifted apart from each other. One day, they're caught in a battle against a ""Censor Bug"" that feeds on human's sexual energy to evolve. After successfully taking down the enemy, they join a group of heroes like them, using the erotic power of the HxEROS force to fight off monsters. 
 
(Source: MU)","['Action', 'Comedy', 'Supernatural', 'Ecchi', 'School', 'Shounen']",Not available,,1600,8806,,,https://cdn.myanimelist.net/images/anime/1675/104026.jpg,https://myanimelist.net/anime/40623/Dokyuu_Hentai_HxEros
13137,Itsuka Tenma no Kuro Usagi Special,"""Chibi-style"" special included in the last Blu-Ray.","['Comedy', 'Ecchi']","Feb 24, 2012",1.0,4835,5828,6215.0,6.47,https://cdn.myanimelist.net/images/anime/9/36791.jpg,https://myanimelist.net/anime/13137/Itsuka_Tenma_no_Kuro_Usagi_Special
