uid,title,synopsis,genre,aired,episodes,members,popularity,ranked,score,img_url,link
2904,Code Geass: Hangyaku no Lelouch R2,"One year has passed since the Black Rebellion, a failed uprising against the Holy Britannian Empire led by the masked vigilante Zero, who is now missing. At a loss without their revolutionary leader, Area 11's resistance group—the Black Knights—find themselves too powerless to combat the brutality inflicted upon the Elevens by Britannia, which has increased significantly in order to crush any hope of a future revolt.  
 
Lelouch Lamperouge, having lost all memory of his double life, is living peacefully alongside his friends as a high school student at Ashford Academy. His former partner C.C., unable to accept this turn of events, takes it upon herself to remind him of his past purpose, hoping that the mastermind Zero will rise once again to finish what he started, in this thrilling conclusion to the series. 
 
[Written by MAL Rewrite] 
","['Action', 'Military', 'Sci-Fi', 'Super Power', 'Drama', 'Mecha']","Apr 6, 2008 to Sep 28, 2008",25.0,992196,27,17.0,8.93,https://cdn.myanimelist.net/images/anime/4/9391.jpg,https://myanimelist.net/anime/2904/Code_Geass__Hangyaku_no_Lelouch_R2
30276,One Punch Man,"The seemingly ordinary and unimpressive Saitama has a rather unique hobby: being a hero. In order to pursue his childhood dream, he trained relentlessly for three years—and lost all of his hair in the process. Now, Saitama is incredibly powerful, so much so that no enemy is able to defeat him in battle. In fact, all it takes to defeat evildoers with just one punch has led to an unexpected problem—he is no longer able to enjoy the thrill of battling and has become quite bored. 
  
This all changes with the arrival of Genos, a 19-year-old cyborg, who wishes to be Saitama's disciple after seeing what he is capable of. Genos proposes that the two join the Hero Association in order to become certified heroes that will be recognized for their positive contributions to society, and Saitama, shocked that no one knows who he is, quickly agrees. And thus begins the story of  One Punch Man , an action-comedy that follows an eccentric individual who longs to fight strong enemies that can hopefully give him the excitement he once felt and just maybe, he'll become popular in the process. 
 
[Written by MAL Rewrite]","['Action', 'Sci-Fi', 'Comedy', 'Parody', 'Super Power', 'Supernatural', 'Seinen']","Oct 5, 2015 to Dec 21, 2015",12.0,1475219,5,50.0,8.68,https://cdn.myanimelist.net/images/anime/12/76049.jpg,https://myanimelist.net/anime/30276/One_Punch_Man
1253,Saint Seiya: Meiou Hades Meikai-hen,"Seiya and the rest of the Bronze and Gold Saints who have survived the Sanctuary battle have entered the world of the Dead. They are fighting to get to Hades and defeat him.  
 
(Source: ANN)","['Action', 'Adventure', 'Demons', 'Fantasy', 'Sci-Fi', 'Shounen', 'Super Power']","Dec 17, 2005 to Feb 6, 2007",12.0,33453,2409,799.0,7.86,https://cdn.myanimelist.net/images/anime/12/75732.jpg,https://myanimelist.net/anime/1253/Saint_Seiya__Meiou_Hades_Meikai-hen
34944,Bungou Stray Dogs: Dead Apple,"A large scale catastrophe is occurring across the planet. Ability users are discovered after the appearance of a mysterious fog, apparently having committed suicide, so the Armed Detective Agency sets out to investigate these mysterious deaths. The case seems to involve an unknown ability user referred to as ""Collector,"" a man who could be the mastermind behind the incident. 
 
Trust and courage are put to the test in order to save the city of Yokohama and ability users across the world from the grip of Collector where the Armed Detective Agency forms an unlikely partnership with the dangerous Port Mafia.  
 
[Written by MAL Rewrite]","['Action', 'Comedy', 'Mystery', 'Super Power', 'Supernatural']","Mar 3, 2018",1.0,73839,1448,780.0,7.86,https://cdn.myanimelist.net/images/anime/1127/93981.jpg,https://myanimelist.net/anime/34944/Bungou_Stray_Dogs__Dead_Apple
269,Bleach,"Ichigo Kurosaki is an ordinary high schooler—until his family is attacked by a Hollow, a corrupt spirit that seeks to devour human souls. It is then that he meets a Soul Reaper named Rukia Kuchiki, who gets injured while protecting Ichigo's family from the assailant. To save his family, Ichigo accepts Rukia's offer of taking her powers and becomes a Soul Reaper as a result. 
 
However, as Rukia is unable to regain her powers, Ichigo is given the daunting task of hunting down the Hollows that plague their town. However, he is not alone in his fight, as he is later joined by his friends—classmates Orihime Inoue, Yasutora Sado, and Uryuu Ishida—who each have their own unique abilities. As Ichigo and his comrades get used to their new duties and support each other on and off the battlefield, the young Soul Reaper soon learns that the Hollows are not the only real threat to the human world. 
 
[Written by MAL Rewrite]","['Action', 'Adventure', 'Comedy', 'Super Power', 'Supernatural', 'Shounen']","Oct 5, 2004 to Mar 27, 2012",366.0,1002578,25,757.0,7.87,https://cdn.myanimelist.net/images/anime/3/40451.jpg,https://myanimelist.net/anime/269/Bleach
5005,Tentai Senshi Sunred,"Tentai Senshi Sunred  is the magnificent story of the conflict between good and evil that takes place in the city of Kawasaki. Sunred, ally of justice, is dedicated to stopping the evil organization Florsheim on their quest for world domination, while General Vamp and his minions are constantly thinking up new schemes to defeat Sunred. In what sounds like a typical story, the characters make all the difference.  
 
Our hero Sunred is rude, violent, and lazy, playing pachinko all day and leeching off of his girlfriend Kayoko Uchida. Meanwhile General Vamp is polite, conscientious, and an ideal homemaker who cooks, mothers his minions, and discusses housekeeping with Kayoko, who bickers constantly with Sunred. Even the monsters of Florsheim tend to be adorable and harmless. 
 
Each episode is comprised of several shorts weighing in at anywhere from a few minutes to a few seconds, and explores the daily lives of these sworn enemies. This is the story of the battle between good and evil that takes place in Kawasaki. 
 
[Written by MAL Rewrite]","['Comedy', 'Parody', 'Super Power', 'Seinen']","Oct 3, 2008 to Mar 28, 2009",26.0,17654,3391,753.0,7.88,https://cdn.myanimelist.net/images/anime/11/11740.jpg,https://myanimelist.net/anime/5005/Tentai_Senshi_Sunred
18397,Shingeki no Kyojin OVA,"Bundled with the 12th, 13th, and 14th limited-edition manga volumes.","['Action', 'Super Power', 'Drama', 'Fantasy', 'Shounen']","Dec 9, 2013 to Aug 8, 2014",3.0,222243,480,751.0,7.88,https://cdn.myanimelist.net/images/anime/9/59221.jpg,https://myanimelist.net/anime/18397/Shingeki_no_Kyojin_OVA
28999,Charlotte,"While on the surface Yuu Otosaka appears to be just another charming and intelligent teenager, he has a secret—he has the ability to slip into people's minds and fully control their body for five seconds at a time. Yuu has been using this skill for years to gain the highest grades, which allowed him to enter a prestigious high school. 
 
When the enigmatic Nao Tomori catches Yuu using his power, she coerces him and his sister Ayumi into transferring to Hoshinoumi Academy, a school for students with supernatural abilities. The student council of the school, led by Nao, is tasked with secretly tracking down adolescents who abuse their powers. Yuu is forced to join the student council and together, they face formidable challenges that bring him closer to the shocking truth that his own, seemingly incomplete ability, might be more powerful than he could have ever imagined. 
 
An original story from Jun Maeda, creator of  Angel Beats  and  Clannad ,  Charlotte  explores the supernatural lives of these teenagers and the price they must pay for being special. 
 
[Written by MAL Rewrite]","['Drama', 'School', 'Super Power']","Jul 5, 2015 to Sep 27, 2015",13.0,734250,66,742.0,7.88,https://cdn.myanimelist.net/images/anime/12/74683.jpg,https://myanimelist.net/anime/28999/Charlotte
267,Gungrave,"Brandon Heat and Harry MacDowel, two friends so close they could be called brothers, receive an abrupt and violent reminder one fateful day of how appallingly merciless the world around them can be. Their whole lives before then were simple and easygoing, consisting largely of local brawls, seducing women, and committing petty theft to make a living and pass the time. What they failed to realize is that in this cruel world, happiness is fleeting, and change is inevitable. 
 
Enter Millennion, the largest and most infamous mafia syndicate in the area, which accepts Brandon and Harry into their ranks and starts them at the bottom of the food chain. Harry has ambitions to ascend the ranks and one day replace Big Daddy as the supreme leader of Millennion, while Brandon only wishes to support his friend and appease Big Daddy who has taken custody of the woman Brandon loves. 
 
Based off the third-person shooter video game under the same name,  Gungrave  is an epic story of friendship, betrayal, and avarice that spans the course of several years, ultimately tying back to the gripping and foreboding first episode, all the while building up to the story's thrilling conclusion. 
 
[Written by MAL Rewrite]","['Action', 'Drama', 'Sci-Fi', 'Seinen', 'Super Power']","Oct 7, 2003 to Mar 30, 2004",26.0,137057,812,727.0,7.89,https://cdn.myanimelist.net/images/anime/11/75724.jpg,https://myanimelist.net/anime/267/Gungrave
6768,Code Geass: Hangyaku no Lelouch R2 Special Edition - Zero Requiem,An OVA summarizing all 25 episodes of season 2.,"['Action', 'Military', 'Super Power', 'Mecha']","Jul 24, 2009",1.0,34345,2372,723.0,7.89,https://cdn.myanimelist.net/images/anime/7/15968.jpg,https://myanimelist.net/anime/6768/Code_Geass__Hangyaku_no_Lelouch_R2_Special_Edition_-_Zero_Requiem
2321,Giant Robo the Animation: Chikyuu ga Seishi Suru Hi,"In a future to come humanity enjoys a new age of prosperity thanks to Dr. Shizuma's invention of a revolutionary renewable energy source: the Shizuma Drive. But this peace is threatened by Big Fire, a cabal seeking world domination. Against Big Fire the International Police Organisation dispatches a collection of superpowered warriors and martial artists, together with Daisaku Kusama, inheritor and master of Earth's most powerful robot, Giant Robo.  
 
By capturing an abnormal Shizuma Drive which is essential to Big Fire's plans the IPO ignites a desperate conflict between the two groups. The coming battle will test Daisaku's resolve to the utmost, reveal the ghastly truth behind the creation of the Shizuma Drive, and bring human civilization to its knees! 
 
Giant Robo is a character-driven adventure in a retro-futuristic setting, drawing on influences from opera, kung-fu cinema, wuxia stories and classic mecha anime. It incorporates characters from the works of the manga author Mitsuteru Yokoyama but it is designed to be a stand-alone story.","['Action', 'Sci-Fi', 'Super Power', 'Drama', 'Mecha', 'Shounen']","Jul 23, 1992 to Jan 25, 1998",7.0,18602,3310,711.0,7.9,https://cdn.myanimelist.net/images/anime/12/27657.jpg,https://myanimelist.net/anime/2321/Giant_Robo_the_Animation__Chikyuu_ga_Seishi_Suru_Hi
20,Naruto,"Moments prior to Naruto Uzumaki's birth, a huge demon known as the Kyuubi, the Nine-Tailed Fox, attacked Konohagakure, the Hidden Leaf Village, and wreaked havoc. In order to put an end to the Kyuubi's rampage, the leader of the village, the Fourth Hokage, sacrificed his life and sealed the monstrous beast inside the newborn Naruto. 
 
Now, Naruto is a hyperactive and knuckle-headed ninja still living in Konohagakure. Shunned because of the Kyuubi inside him, Naruto struggles to find his place in the village, while his burning desire to become the Hokage of Konohagakure leads him not only to some great new friends, but also some deadly foes. 
 
[Written by MAL Rewrite]","['Action', 'Adventure', 'Comedy', 'Super Power', 'Martial Arts', 'Shounen']","Oct 3, 2002 to Feb 8, 2007",220.0,1280914,9,670.0,7.93,https://cdn.myanimelist.net/images/anime/13/17405.jpg,https://myanimelist.net/anime/20/Naruto
6582,Tentai Senshi Sunred 2nd Season,The second season of  Tentai Senshi Sunred .,"['Comedy', 'Parody', 'Seinen', 'Super Power']","Oct 3, 2009 to Mar 27, 2010",26.0,6317,5234,614.0,7.98,https://cdn.myanimelist.net/images/anime/7/15051.jpg,https://myanimelist.net/anime/6582/Tentai_Senshi_Sunred_2nd_Season
34451,Kekkai Sensen & Beyond,"Three years ago, a gateway between Earth and the Beyond opened in New York City, trapping extradimensional creatures and humans alike in an impermeable bubble. After the city's restoration, monsters, magic, and madness are common findings in the area now known as Hellsalem's Lot. Leonardo Watch, a young photographer who unwillingly obtained the ""All-seeing Eyes of the Gods"" in exchange for his sister's eyesight, came to this paranormal city to find answers to the mysterious power that he possesses. He later finds his life drastically changed when he joins Libra, a secret organization of people with supernatural abilities dedicated to maintaining order in the everyday chaos of Hellsalem's Lot.  
 
However, this is only the beginning of Leonardo's unexpected journey ahead. Regardless of the constant threat of otherworldly enemies, he is determined to uncover the secrets of his power and find a way to restore his sister's eyesight.  Kekkai Sensen & Beyond  follows Leonardo as he sets off on more crazy adventures with his comrades, fighting to ensure peace and order. 
 
[Written by MAL Rewrite]","['Action', 'Comedy', 'Fantasy', 'Shounen', 'Super Power', 'Supernatural', 'Vampire']","Oct 8, 2017 to Dec 24, 2017",12.0,222920,478,601.0,7.99,https://cdn.myanimelist.net/images/anime/3/88282.jpg,https://myanimelist.net/anime/34451/Kekkai_Sensen___Beyond
39565,Boku no Hero Academia the Movie 2: Heroes:Rising,,"['Action', 'Comedy', 'Super Power', 'School', 'Shounen']","Dec 20, 2019",1.0,75929,1408,594.0,7.97,https://cdn.myanimelist.net/images/anime/1019/103292.jpg,https://myanimelist.net/anime/39565/Boku_no_Hero_Academia_the_Movie_2__Heroes_Rising
9941,Tiger & Bunny,"In Stern Bild City, those with special abilities are called ""NEXT,"" and can use their powers for good or bad. A unique organized group of NEXT appear regularly on Hero TV, where they chase down evildoers to bring limelight to their sponsors and earn Hero Points in the hopes of becoming the next ""King of Heroes."" 
 
Kotetsu T. Kaburagi, known as ""Wild Tiger,"" is a veteran hero whose performance has been dwindling as of late, partially due to his inability to cooperate with other heroes. After a disappointing season in which most of the other heroes far outperformed Tiger, he is paired up with a brand new hero who identifies himself by his real name—Barnaby Brooks Jr. 
 
Barnaby, nicknamed ""Bunny"" by his frivolous new partner, quickly makes it clear that the two could not be more different. Though they mix as well as oil and water, Tiger and Bunny must learn to work together, both for the sake of their careers and to face the looming threats within Stern Bild. 
 
[Written by MAL Rewrite]","['Action', 'Mystery', 'Comedy', 'Super Power']","Apr 3, 2011 to Sep 18, 2011",25.0,162364,682,589.0,8.0,https://cdn.myanimelist.net/images/anime/13/29466.jpg,https://myanimelist.net/anime/9941/Tiger___Bunny
36215,One Piece: Episode of East Blue - Luffy to 4-nin no Nakama no Daibouken,"The words that Gold Roger, the King of the Pirates, uttered just before his death excited the masses and the world has entered a Great Pirate Era! There is a group of young pirates who are about to set sail on the Grand Line. Monkey D. Luffy, a rubber man. Roronoa Zoro aka “Pirate Hunter.” Usopp, a sniper. Sanji, a seafaring cook. And “Cat Burglar” Nami. They, the Straw Hats, all place a foot upon a barrel and make their vows before their next journey across the great ocean. Luffy shouts “In order to be the King of the Pirates!” A decade ago in the Windmill Village... A little boy Luffy was enthralled with a pirate boss Red-Haired Shanks. But a group of mountain bandits shows up and makes fun of the pirates. “Why didn't you fight them?!” Luffy yells out angrily but Shanks says that it's nothing worth getting mad over. At that time, Luffy snatches the Gum-Gum Fruit from a treasure box and eats it and as a result, his entire body becomes rubber and he loses the ability to swim for the rest of his life! A few days later, Luffy is surrounded by the mountain bandits again and Shanks comes to help. “No matter what the reason, anyone who hurts my friends has to pay!!” Shanks and his pirate crew are incredibly strong and they beat down the mountain bandits. Higuma, the head of the mountain bandits, runs away kidnapping Luffy and heads for the sea. However, they encounter a local Sea Monster there and are attacked. Luffy is in a desperate situation... But again, Shanks saves the day. He outstares the Sea Monster and chases it away but in exchange, he loses his left arm... When Shanks leaves the village, he leaves his straw hat with Luffy. “Come bring it back to me someday! Once you've become a great pirate!” 10 years later, Luffy has grown up strong and he sets out for an adventure on a small boat. He again encounters the local Sea Monster for that fateful day. However, Luffy takes it down with a single blow of Gum-Gum Pistol. Luffy’s journey to become the King of the Pirates now begins! 
 
(Source: Crunchyroll)","['Action', 'Adventure', 'Comedy', 'Super Power', 'Drama', 'Fantasy', 'Shounen']","Aug 26, 2017",1.0,15533,3624,569.0,8.01,https://cdn.myanimelist.net/images/anime/10/87473.jpg,https://myanimelist.net/anime/36215/One_Piece__Episode_of_East_Blue_-_Luffy_to_4-nin_no_Nakama_no_Daibouken
7338,Darker than Black: Kuro no Keiyakusha Gaiden,"Fleeing from the consequences of his decision at the Hell's Gate, superpowered Contractor Hei and his companion Yin take refuge in a quiet inn, adopting the guise of a married couple in order to not draw suspicion. In an attempt to recover from recent events, Hei befriends the inn's other guests. He discovers that one of them is a fellow Contractor tasked with killing him. Their resulting encounter spells disaster for both Hei and Yin, who are forced to fight for their lives and grapple with the emotional wounds sustained in their previous life together. 
 
[Written by MAL Rewrite]","['Action', 'Mystery', 'Sci-Fi', 'Super Power']","Jan 27, 2010 to Jul 21, 2010",4.0,195048,552,541.0,8.02,https://cdn.myanimelist.net/images/anime/3/17469.jpg,https://myanimelist.net/anime/7338/Darker_than_Black__Kuro_no_Keiyakusha_Gaiden
77,Mahou Shoujo Lyrical Nanoha A's,"After the events of the Lost Logia case, Nanoha waits patiently for the day she can reunite with her newfound friend, Fate. Although being an exceptionally powerful mage, Nanoha spends her days normally with her friends on Earth. But peace is once again suddenly shattered, as Nanoha is without warning attacked by a powerful mage. A group of violent mages have been attacking anything with magic power for their own goals. Nanoha and Fate, along with their friends Yuuno, Arf, Chrono and the Space/Time Administration Bureau must once more band together to stop these renegade mages from hurting anyone or anything else. Takes place after the first season of Lyrical Nanoha.","['Action', 'Comedy', 'Drama', 'Magic', 'Super Power']","Oct 2, 2005 to Dec 25, 2005",13.0,52796,1825,523.0,8.04,https://cdn.myanimelist.net/images/anime/4/6767.jpg,https://myanimelist.net/anime/77/Mahou_Shoujo_Lyrical_Nanoha_As
34438,Code Geass: Hangyaku no Lelouch I - Koudou,"The Holy Britannian Empire is a powerful nation that uses its military strength to expand its rule, and the small island nation of Japan is yet another victim. During a worldwide conflict in 2010 known as the Second Pacific War, the once proud country was reduced to rubble and mockingly renamed to Area 11.  
 
However, one student plans to free Japan from Britannia's control through an extraordinary rebellion. His name is Lelouch Lamperouge, and he is fueled with hatred for the Empire, plotting to wipe its accursed name off the face of the planet. Lelouch's malicious plans are unexpectedly accelerated upon meeting the mysterious woman C.C., who grants him a supernatural ability known as ""Geass"" that makes anyone Lelouch commands unable to defy his will.  
 
Now armed with a devastating power, Lelouch assumes the persona of Zero, a revolutionary figure who carries the hopes and dreams of the oppressed around the world. He vows to restore the glorious nation of Japan and deliver divine retribution to Britannia. 
 
[Written by MAL Rewrite]","['Action', 'Military', 'Sci-Fi', 'Super Power', 'Mecha', 'School']","Oct 21, 2017",1.0,48098,1964,492.0,8.06,https://cdn.myanimelist.net/images/anime/6/87709.jpg,https://myanimelist.net/anime/34438/Code_Geass__Hangyaku_no_Lelouch_I_-_Koudou
36896,Boku no Hero Academia the Movie 1: Futari no Hero,"U.A. High School's students of Class 1-A have made it to summer break. Izuku Midoriya accompanies his mentor All Might to a celebratory superhero festival on I-Island, an isolated patch of land dedicated to researching Quirks and everything else associated with the hero business. Midoriya is granted the opportunity to meet All Might's friend Dave and Dave's daughter Melissa, two talented hero equipment engineers. He also encounters his classmates, most of whom have been given the opportunity to spend part of their summer break at the festival. 
 
However, a mysterious squad of villains infiltrates I-Island, and it is up to Midoriya and his friends to confront them, using their developing Quirks to fight off the new enemy and uncover a treacherous plot. 
 
[Written by MAL Rewrite]","['Action', 'Shounen', 'Super Power']","Aug 3, 2018",1.0,220604,490,481.0,8.07,https://cdn.myanimelist.net/images/anime/1736/93138.jpg,https://myanimelist.net/anime/36896/Boku_no_Hero_Academia_the_Movie_1__Futari_no_Hero
8740,One Piece Film: Strong World Episode 0,"Set over 20 years prior to the main One Piece story, this limited release OVA chronicles the confrontation between Gold Lion Shiki and Gold Roger as well as other events around the world around the time of the Pirate King's execution. ","['Action', 'Adventure', 'Comedy', 'Fantasy', 'Shounen', 'Super Power']","Apr, 2010",1.0,54305,1793,475.0,8.08,https://cdn.myanimelist.net/images/anime/2/24152.jpg,https://myanimelist.net/anime/8740/One_Piece_Film__Strong_World_Episode_0
16049,Toaru Kagaku no Railgun S,"Mikoto Misaka and her friends are back, investigating rumors across Academy City. Soon, Mikoto discovers something terrifying: horrific experiments are taking place throughout the city, involving the murder of thousands of espers. Moreover, these espers are far from just ordinary people: they are clones of Mikoto herself. Feeling responsible for their treatment, she sets off to put an end to the experiments; however, the forces opposing her are much more dangerous than she anticipated, and Mikoto finds herself up against some of the most powerful espers imaginable. 
 
 Toaru Kagaku no Railgun S  continues the story of the Railgun as she desperately fights to put an end to the inhuman experiments that she believes she helped cause, her life dragged deep into despair in the process. There's never a dull moment in Academy City, but no one ever said all of them would be pleasant. 
 
[Written by MAL Rewrite]","['Action', 'Sci-Fi', 'Super Power']","Apr 12, 2013 to Sep 27, 2013",24.0,224991,473,452.0,8.1,https://cdn.myanimelist.net/images/anime/7/75610.jpg,https://myanimelist.net/anime/16049/Toaru_Kagaku_no_Railgun_S
6171,Saint Seiya: The Lost Canvas - Meiou Shinwa,"A Holy War, from ancient mythology, where the Goddess Athena and Hades have fought against each other while defending the earth repeatedly over the span of 200 years. The story takes place in 18th century Europe, 243 years prior to the original ""Saint Seiya"" Three small children, Tenma, Alone, and Sasha have all shared a very happy childhood together. Tenma who is quite aggressive but upstanding has moved to Sanctuary to become a saint. It is there that he is reunited with Sasha who is the sister of Alone and learns that she is the reincarnation of Goddess Athena. Alone, who is kind, gentle and loves painting was chosen for the body of enemy King Hades. Tenma eventually becomes a saint of Pegasus and engages in a fierce battle with his best friend Alone, the King of Hades. Pegasus Tenma, King Hades, and the Goddess Athena and through the twist of their 3 fates merge together which unfolds a prologue to the original Saint Seiya. 
 
(Source: TMS Entertaiment)","['Action', 'Adventure', 'Martial Arts', 'Shounen', 'Super Power', 'Supernatural']","Jun 24, 2009 to Apr 21, 2010",13.0,70132,1495,448.0,8.1,https://cdn.myanimelist.net/images/anime/8/75546.jpg,https://myanimelist.net/anime/6171/Saint_Seiya__The_Lost_Canvas_-_Meiou_Shinwa
