uid,title,synopsis,genre,aired,episodes,members,popularity,ranked,score,img_url,link
2025,Darker than Black: Kuro no Keiyakusha,"It has been 10 years since Heaven's Gate appeared in South America and Hell's Gate appeared in Japan, veiling the once familiar night sky with an oppressive skyscape. Their purposes unknown, these Gates are spaces in which the very laws of physics are ignored. With the appearance of the Gates emerged Contractors, who, in exchange for their humanity, are granted supernatural abilities. 
 
In the Japanese city surrounding Hell’s Gate, Section 4 Chief Misaki Kirihara finds herself at odds with an infamous Contractor codenamed Hei. Called ""Black Reaper"" in the underground world, Hei, like his associates, undertakes missions for the mysterious and ruthless Syndicate while slowly peeling back the dark layers covering a nefarious plot that threatens the very existence of Contractors. 
 
From the mind of Tensai Okamura comes a sci-fi thriller taking the form of a subtle exposé on a war in which political positions and justice have no sway—a war waged exclusively in the shadows. 
 
[Written by MAL Rewrite]","['Action', 'Sci-Fi', 'Mystery', 'Super Power']","Apr 6, 2007 to Sep 28, 2007",25.0,656341,76,352.0,8.17,https://cdn.myanimelist.net/images/anime/5/19570.jpg,https://myanimelist.net/anime/2025/Darker_than_Black__Kuro_no_Keiyakusha
38003,Bungou Stray Dogs 3rd Season,"Following the conclusion of the three-way organizational war, government bureaucrat Ango Sakaguchi recalls an event that transpired years ago, after the death of the former Port Mafia boss. Osamu Dazai, still a new recruit at the time, was tasked with investigating rumors related to a mysterious explosion that decimated part of the city years ago—and its connection to the alleged reappearance of the former boss. 
 
Due to circumstances out of his control, he is partnered with Chuuya Nakahara, the gifted yet impulsive leader of a rival clan known as the ''Sheep,'' to uncover the truth behind the case and shine a light on the myth of Arahabaki—the god of fire who might just lead Dazai to the case's solution. 
 
Meanwhile, in the present day, it is business as usual once again for the Armed Detective Agency. Their peaceful break will not last for long, however, as enemies old and new gather their strength and prepare for another face-off. 
 
[Written by MAL Rewrite]","['Action', 'Mystery', 'Seinen', 'Super Power', 'Supernatural']","Apr 12, 2019 to Jun 28, 2019",12.0,149617,750,351.0,8.17,https://cdn.myanimelist.net/images/anime/1037/100463.jpg,https://myanimelist.net/anime/38003/Bungou_Stray_Dogs_3rd_Season
16808,Hwanggeum Cheolin,The titular hero sets out on a journey to the underworld.,"['Action', 'Kids', 'Adventure', 'Super Power', 'Demons']","Jul 25, 1968",1.0,212,13185,11118.0,4.78,https://cdn.myanimelist.net/images/anime/3/45148.jpg,https://myanimelist.net/anime/16808/Hwanggeum_Cheolin
37249,DC Super Heroes vs Taka no Tsume Dan Promotion Eizou,"A collaboration episode promoting the BD/DVD release of  DC Super Heroes vs Taka no Tsume Dan  and the Japanese BD/DVD release of  Justice League  both going on sale March 3, 2018 with the special goods that come with them. The characters all break the 4th wall to self-promote their material and get into a scuffle about whose release would sell better. 
 
","['Comedy', 'Parody', 'Super Power']","Feb 2, 2018",1.0,394,11547,11000.0,4.89,https://cdn.myanimelist.net/images/anime/1334/90401.jpg,https://myanimelist.net/anime/37249/DC_Super_Heroes_vs_Taka_no_Tsume_Dan_Promotion_Eizou
39038,Anon Sentai Ranger 5,Anon Pictures' parody of Super Sentai opening sequences.,"['Music', 'Parody', 'Super Power']","Feb 15, 2011",1.0,108,15143,10951.0,4.94,https://cdn.myanimelist.net/images/anime/1250/98338.jpg,https://myanimelist.net/anime/39038/Anon_Sentai_Ranger_5
38234,One Piece Movie 14: Stampede,,"['Action', 'Adventure', 'Comedy', 'Super Power', 'Drama', 'Fantasy', 'Shounen']","Aug 9, 2019",1.0,25738,2793,345.0,8.18,https://cdn.myanimelist.net/images/anime/1221/100550.jpg,https://myanimelist.net/anime/38234/One_Piece_Movie_14__Stampede
23935,Kyutai Panic Adventure Returns!,"A special screened at an event named Odaiba Boken-Oh, featuring characters from  Dragon Ball Z ,  One Piece  and  Kochira Katsushikaku Kameari Kouenmae Hashutsujo .","['Action', 'Shounen', 'Super Power']",2004,1.0,1415,8783,10821.0,5.05,https://cdn.myanimelist.net/images/anime/3/62121.jpg,https://myanimelist.net/anime/23935/Kyutai_Panic_Adventure_Returns
35329,Ultrasonico,"2017 April Fools' Day event where Nitro+ mascot Super Sonico is becoming an Ultraman-esque superhero, ""Ultrasonico.""","['Parody', 'Super Power']","Apr 1, 2017",1.0,1546,8564,10688.0,5.15,https://cdn.myanimelist.net/images/anime/12/85083.jpg,https://myanimelist.net/anime/35329/Ultrasonico
2737,Kouryuu no Mimi: Mina no Shou,"Based on the manga by Inoue Noriyoshi, which has also had a Super Famicom game spinoff. 
 
Natsume Kiroemon, the protagonist, was the 45th leader of the Natsume family, and inherit the ""Kiryuu no Mimi "", a tool which gave its bearer easy access to wealth and women. As a result of his father's death, he left the Italian monastery where he'd been training and rightfully took the name ""Natsume Kiroemon"" as well as the power of the Kiryuu no Mimi. Upon his return to Japan, he fell fatally in love with Kanako, one of the members of the rival Mina family. However, the evil hand of the Mina family attacked Natsume constantly and abducted Kanako. Now Natsume has unlocked the seal, making the Kiryuu's power surge, and he's striking back at the Mina family. 
 
(Source: AniDB)","['Action', 'Super Power', 'Drama']","Apr 26, 1995 to Jun 1, 1995",2.0,661,10373,10613.0,5.19,https://cdn.myanimelist.net/images/anime/10/59847.jpg,https://myanimelist.net/anime/2737/Kouryuu_no_Mimi__Mina_no_Shou
2905,Ikkitousen: Dragon Destiny Specials,Ikkitousen Dragon Destiny Specials.,"['Super Power', 'Ecchi', 'Martial Arts', 'School']","Jun 24, 2007 to Nov 24, 2007",6.0,18940,3272,4995.0,6.72,https://cdn.myanimelist.net/images/anime/13/89207.jpg,https://myanimelist.net/anime/2905/Ikkitousen__Dragon_Destiny_Specials
22699,Dragon Ball Z: Zenbu Misemasu Toshi Wasure Dragon Ball Z!,"In this film, which is believed to take place some time around the 25th World Martial Arts Tournament, Gohan and Goten are having a hot bath outside in the middle of winter. Goku (who is still dead) suddenly appears in front of his sons with the help of his Instant Transmission, and joins them in the tub. While there, the three Saiyans reflect back on the events that occurred during the Cell Games. Inside the house after Chi-Chi appeared, Goku tells his sons about Pikkon and the Other World Tournament. 
 
Later, the four members of the Son family appear dressed nicely. Gohan says that the adult division of the Tournament will begin this next year (in 1994), and the special comes to an end. 
 
(Source: Dragon Ball Wikia)","['Action', 'Slice of Life', 'Adventure', 'Fantasy', 'Martial Arts', 'Comedy', 'Super Power', 'Shounen']","Dec 31, 1993",1.0,9622,4417,4986.0,6.72,https://cdn.myanimelist.net/images/anime/12/60349.jpg,https://myanimelist.net/anime/22699/Dragon_Ball_Z__Zenbu_Misemasu_Toshi_Wasure_Dragon_Ball_Z
38419,Tokyo One Piece Tower: Tongari Shima no Dai Hihou,"A  Tokyo One Piece Tower  exclusive film. It's a tie-in to a real treasure hunting event in collaboration with Takarush Corp. for a limited time called  Treasure Hunting: Tongari Shima no Daibouken . During this you’ll decipher the mysteries of ancient documents found by Luffy, Usopp, and Chopper, and then set out to find the nest of the mysterious animal known as Tongari Ton!  
 
The film itself begins at the end of your treasure hunting adventure at the Tokyo One Piece Tower, where the Straw Hat Crew are tricked into opening a chest in a cave thinking it's where the Tongari Island treasure is.  
 
(Source: Otakumode)","['Action', 'Adventure', 'Super Power', 'Shounen']","Nov 1, 2016",1.0,4040,6260,4973.0,6.73,https://cdn.myanimelist.net/images/anime/1203/95013.jpg,https://myanimelist.net/anime/38419/Tokyo_One_Piece_Tower__Tongari_Shima_no_Dai_Hihou
156,X,"His destiny has finally arrived as the young Shirou Kamui returns to Tokyo after 6 years. A powerful psychic, Kamui vows to protect the happiness of his childhood friends Fuuma and Kotori, even if it means avoiding them. But fate is cruel, whether or not Kamui wants to be involved; he holds the future of the world in his hands, given the choice of becoming a Dragon of Heaven or a Dragon of Earth. The Seven Seals gather, and so do the Seven Angels; all individuals who have their destiny carved out as one who would battle for the fate of the world. What future will Kamui choose to become reality?","['Action', 'Super Power', 'Drama', 'Magic', 'Romance', 'Fantasy', 'Shoujo']","Oct 3, 2001 to Mar 27, 2002",24.0,63873,1592,1776.0,7.49,https://cdn.myanimelist.net/images/anime/8/17167.jpg,https://myanimelist.net/anime/156/X
11255,Ikkitousen: Shuugaku Toushi Keppuuroku,Ikkitousen OVA.,"['Action', 'Ecchi', 'Martial Arts', 'Super Power', 'School']","Nov 12, 2011",1.0,13292,3851,4955.0,6.73,https://cdn.myanimelist.net/images/anime/2/33853.jpg,https://myanimelist.net/anime/11255/Ikkitousen__Shuugaku_Toushi_Keppuuroku
32737,009 Re:Cyborg x Zip,A series of animated shorts done in collaboration with Zip.,"['Comedy', 'Super Power']","Oct 15, 2012 to Oct 26, 2012",10.0,854,9859,10499.0,5.24,https://cdn.myanimelist.net/images/anime/6/78556.jpg,https://myanimelist.net/anime/32737/009_Re_Cyborg_x_Zip
11635,Sacred Seven: Shirogane no Tsubasa,A recap special that will feature the battles of Alma and Knight. The past story of Knight will be described with new animations.,"['Action', 'School', 'Sci-Fi', 'Super Power']","Jan 7, 2012",1.0,5177,5682,4920.0,6.74,https://cdn.myanimelist.net/images/anime/12/34505.jpg,https://myanimelist.net/anime/11635/Sacred_Seven__Shirogane_no_Tsubasa
1596,Arcade Gamer Fubuki,"Fubuki Sakuragasaki is a powerful gamer who, with the power of her Passion Panties, climbs up the ranks of the BAG (Best of Arcade Gamer) tournament to become the greatest Arcade Gamer in the world. However, the evil Gulasic Group is out to conquer the world through said tournament, and their gaming skills will prove to be a challenge. Fubuki must team up with the legendary Mr. Mystery to combat the four Gods of Gaming and make the world of arcade gaming safe for all.  
 
(Source: ANN)","['Action', 'Comedy', 'Ecchi', 'Parody', 'Shounen', 'Sports', 'Super Power']","Feb 25, 2002 to Jan 25, 2003",4.0,4898,5797,10424.0,5.28,https://cdn.myanimelist.net/images/anime/2/5065.jpg,https://myanimelist.net/anime/1596/Arcade_Gamer_Fubuki
11209,Maken-Ki! OVA,OVA episodes bundled with the 8th and 11th volumes of the manga.,"['Action', 'Ecchi', 'Harem', 'Martial Arts', 'School', 'Super Power']","Mar 1, 2012 to Sep 25, 2013",2.0,39324,2219,4905.0,6.74,https://cdn.myanimelist.net/images/anime/7/36929.jpg,https://myanimelist.net/anime/11209/Maken-Ki_OVA
3021,Yume Senshi Wingman,"Hirono Kenta is your average geeky junior high school student. His childhood obsession has always been Tokusatsu and anime. In fact, he fancies himself as a ""Hero of Justice"" and often is seen running around in a makeshift costume of his own design called ""Wing Man."" Most of his fellow classmates thinks he's just a crazy otaku, but his childhood friend Ogawa Miku thinks he's a noble spirit. 
 
One day as Hirono is walking to school, a beautiful and voluptuous girlliterally drops out of the sky and into his life. Hirono, bewildered by the event, none-the-less takes the girl to his home to recuperate (this is his duty as a ""Hero of Justice""). He also keeps the ""Dream Note"" so that he can transpose his favorite ""Wing Man"" costume designs into it. 
 
Later, Hirono is confronted by the girl who reveals herself to be Yume Aoi, Princess of the Dreamscape called Botoreem. Her domain has been conquered by the power mad despot, Rimeru and his armies of monstrous ""Seed Men."" She barely escaped her domain with the power artifact known as the ""Dream Note."" The ""Dream Note"" enables its possessor to create anything they desire by merely drawing or writing information within its pages. Rimeru seeks to steal it to become Master of the Universe. She demands that Hirono give her back the book, but Hirono had already begun drawing into the book (mystically linking himself to it). 
 
Hirono soon discovers that his designs and notes on Wing Man become reality and he in turn becomes his own creation. Using these powers and abilities, he and Aoi begin their strange and amazing adventure. Along the way, Hirono inadvertently involves all of his friends, especially Miku in his quest to help Aoi free her people and save her father. 
 
Rimeru sends his various minions to Earth's dimension to retrieve the book. One his henchmen is the noble yet devious Kitakura who goes as far as infiltrating Hirono's junior high school masquerading as a teacher. 
 
(Source: AniDB)","['Action', 'Comedy', 'Super Power', 'Romance', 'School']","Feb 7, 1984 to Feb 26, 1985",47.0,1640,8399,4879.0,6.75,https://cdn.myanimelist.net/images/anime/7/75183.jpg,https://myanimelist.net/anime/3021/Yume_Senshi_Wingman
1059,Mutant Turtles: Choujin Densetsu-hen,"When the Teenage Mutant Ninja Turtles acquire Mutastones from Crys-Mu, the spirit of light, they acquire the ability to enhance themselves into Super Turtles for a duration of three minutes. Meanwhile, the evil Shredder and his minions Bebop and Rocksteady stumble upon the Dark Mutastone, which transforms them into Devil Shredder, Supermutant Bebop and Supermutant Rocksteady, respectively. But the Turtles have one more trick up their shells: all four of them can combine into their ultimate form—Turtle Saint. 
 
(Source: ANN)","['Action', 'Adventure', 'Comedy', 'Sci-Fi', 'Super Power']","May 21, 1996",2.0,2222,7694,10375.0,5.31,https://cdn.myanimelist.net/images/anime/12/44255.jpg,https://myanimelist.net/anime/1059/Mutant_Turtles__Choujin_Densetsu-hen
31116,Momotaros no Natsuyasumi,"Momotaros's Summer Vacation is a short film that debuted between the  Gekiranger  movie and  I'm Born! . Using live action photographs, 3D computer graphics, and traditional animation (all of which is termed a Momotion Picture, it has Momotaros gloating of his strength until Sha-Fu dared him to proved it by swimming. After being made fun of by Urataros and Ryutaros, and bashed by Kintaros, Momotaros is talked into believing he can swim by Deneb. But as the ""mind over matter"" influence wears off, the Imagin and Sha-Fu tell the audience the movie's coming up soon. 
 
(Source: Wikipedia)","['Action', 'Comedy', 'Kids', 'Parody', 'Super Power']","Aug 4, 2007",1.0,159,14116,10295.0,5.35,https://cdn.myanimelist.net/images/anime/12/74748.jpg,https://myanimelist.net/anime/31116/Momotaros_no_Natsuyasumi
31147,Concrete Revolutio: Choujin Gensou,"On a sunny July day in the 41st year of the Shinka Era, Jirou Hitoyoshi is tasked with covertly listening in on a secret meeting between a top government scientist and an industrial spy. However, his cover is blown, and the spy reveals himself to be an alien in disguise. Amidst the ensuing chaos, Jirou enlists the aid of cafe waitress and magical girl Kikko Hoshino, one of many ""superhumans"" who blend into society and secretly protect humanity from extraterrestrial threats. As a member of the government agency known as the Super Population Research Laboratory, Jirou has the dual task of protecting superhumans that defend humanity and disposing of any deemed too dangerous to live. Having proven herself a worthy ally, Kikko is invited to join the agency as its newest recruit. 
 
Fast forward five years: disapproval and distaste for superhumans are now commonplace in Tokyo. From government corruption and conflicting ideas of justice, to the morality of superhuman rights, the relationship between humans and the supernatural minority balances precariously in a world pervaded by whispers of unrest and unease. Under mysterious circumstances, Jirou has betrayed the agency, and is now a fugitive on the run. As he skulks through the rainy back alleys of Shinjuku, he is pursued by the very same superhumans that he himself once recruited. 
 
[Written by MAL Rewrite]","['Action', 'Demons', 'Drama', 'Fantasy', 'Mystery', 'Sci-Fi', 'Super Power', 'Supernatural']","Oct 4, 2015 to Dec 27, 2015",13.0,68288,1531,4834.0,6.75,https://cdn.myanimelist.net/images/anime/3/76143.jpg,https://myanimelist.net/anime/31147/Concrete_Revolutio__Choujin_Gensou
3511,Riki-Oh 2: Horobi no Ko,"Child of Destruction is the sequel to the RIKI-OH OVA Wall of Hell.  Child of Destruction tells us more of Riki's past, as we flash back to his childhood to learn the terrible fate of his mother and how he himself was taken away from his twin brother Nachi during a game of hide-and-seek, with Nachi's plaintive cry of ""Are you ready yet?"" haunting him through the years. Riki has a six-pointed star emblazoned on his hand, while Nachi has a swastika on his, the significance of which go unexplained. Riki finds himself in the town of Misaki, dotted with illegal nuclear power plants and run by a religious fanatic military organization called ""God's Judgment."" He is taken prisoner and made to fight in gladiatorial matches in a sprawling arena. He finds his brother, whose special powers have given him the name of ""Savior,"" but his reunion with his resentful sibling turns sour rather quickly. Part 2 is much gorier than Part 1, with Riki smashing his fists into numerous soldier opponents with far less restraint. 
 
(Source: IMDb)","['Action', 'Martial Arts', 'Super Power', 'Seinen']","Aug 24, 1990",1.0,1350,8876,10246.0,5.37,https://cdn.myanimelist.net/images/anime/8/82906.jpg,https://myanimelist.net/anime/3511/Riki-Oh_2__Horobi_no_Ko
36524,Dies Irae: Reimei,Episode 0 of  Dies Irae .,"['Action', 'Super Power', 'Magic']","Oct 7, 2017",1.0,18997,3270,10219.0,5.38,https://cdn.myanimelist.net/images/anime/9/88229.jpg,https://myanimelist.net/anime/36524/Dies_Irae__Reimei
1515,Sentou Yousei Shoujo Tasukete! Mave-chan,"Rei goes to an anime convention and ends up in a world created by the desires of anime fans. Rei doesn't know how to get back and the world starts to collapse because the convention is coming to a close.  
 
(Source: AniDB)","['Parody', 'Comedy', 'Super Power', 'Sci-Fi', 'Shounen']","Feb 24, 2005",1.0,2787,7163,10181.0,5.4,https://cdn.myanimelist.net/images/anime/2/20066.jpg,https://myanimelist.net/anime/1515/Sentou_Yousei_Shoujo_Tasukete_Mave-chan
19123,One Piece: Episode of Merry - Mou Hitori no Nakama no Monogatari,"The story arcs aboard the Straw Hat Crew's first ship Going Merry (Merry Go in some adaptations) are recreated with brand-new animation, from Luffy and Usopp's fight and Robin's disappearance to the crew's final farewell to the ship. Going Merry is treated as another member of the Straw Hats as Luffy, Zoro, Nami, and the rest of the crew set sail for the legendary treasure, the One Piece. 
 
(Source: ANN)","['Action', 'Adventure', 'Comedy', 'Drama', 'Fantasy', 'Shounen', 'Super Power']","Aug 24, 2013",1.0,34900,2356,320.0,8.2,https://cdn.myanimelist.net/images/anime/9/61015.jpg,https://myanimelist.net/anime/19123/One_Piece__Episode_of_Merry_-_Mou_Hitori_no_Nakama_no_Monogatari
1735,Naruto: Shippuuden,"It has been two and a half years since Naruto Uzumaki left Konohagakure, the Hidden Leaf Village, for intense training following events which fueled his desire to be stronger. Now Akatsuki, the mysterious organization of elite rogue ninja, is closing in on their grand plan which may threaten the safety of the entire shinobi world. 
  
Although Naruto is older and sinister events loom on the horizon, he has changed little in personality—still rambunctious and childish—though he is now far more confident and possesses an even greater determination to protect his friends and home. Come whatever may, Naruto will carry on with the fight for what is important to him, even at the expense of his own body, in the continuation of the saga about the boy who wishes to become Hokage. 
 
[Written by MAL Rewrite]","['Action', 'Adventure', 'Comedy', 'Super Power', 'Martial Arts', 'Shounen']","Feb 15, 2007 to Mar 23, 2017",500.0,1059649,19,318.0,8.2,https://cdn.myanimelist.net/images/anime/5/17407.jpg,https://myanimelist.net/anime/1735/Naruto__Shippuuden
19855,Nobunagun,"Shio Ogura is a Japanese high school student, who is visiting Taiwan on a school trip when she is suddenly attacked by monsters. Agents known as ""E-Gene Holders"" from the government agency DOGOO also arrive, who wield weapons infused with the spirits of historical figures. Shio is revealed to also be an E-Gene Holder when the soul of Oda Nobunaga awakens after she tries to rescue a friend. 
 
(Source: Wikipedia)","['Action', 'Sci-Fi', 'Super Power']","Jan 5, 2014 to Mar 30, 2014",13.0,55794,1757,4806.0,6.76,https://cdn.myanimelist.net/images/anime/13/58141.jpg,https://myanimelist.net/anime/19855/Nobunagun
1027,Psychic Force,"There are two kinds of people in the world, normal and psychics. Psychics are rare, powerful and feared. Burn Griffith met and befriended one of them, Keith Evans, two years ago. Now he has been looking for his friend, but when he finally succeeds, something's not right. The world has changed, and so has Keith. 
 
(Source: ANN)","['Action', 'Super Power', 'Sci-Fi', 'Shounen']","May 25, 1998",2.0,1575,8510,10092.0,5.43,https://cdn.myanimelist.net/images/anime/1091/94164.jpg,https://myanimelist.net/anime/1027/Psychic_Force
32271,Dies Irae,"On May 1, 1945 in Berlin, as the Red Army raises the Soviet flag over the Reichskanzlei, a group of Nazi officers conduct a ritual. For them, the slaughter in the city is nothing but the perfect ritual sacrifice in order to bring back the Order of the 13 Lances, a group of supermen whose coming would bring the world's destruction. Years later, no one knows if this group of officers succeeded, or whether they lived or died. Few know of their existence, and even those who knew began to pass away as the decades passed. 
 
Now in December in the present day in Suwahara City, Ren Fujii spends his days at the hospital. It has been two months since the incident that brought him to the hospital: a fight with his friend Shirou Yusa where they almost tried to kill each other. He tries to value what he has left to him, but every night he sees the same dream: a guillotine, murderers who hunt people, and the black clothed knights who pursue the murderers. He is desperate to return to his normal, everyday life, but even now he hears Shirou's words: ""Everyone who remains in this city eventually loses their minds."" 
 
(Source: ANN)","['Action', 'Military', 'Super Power', 'Magic']","Oct 14, 2017 to Dec 23, 2017",11.0,97796,1121,9989.0,5.46,https://cdn.myanimelist.net/images/anime/2/89682.jpg,https://myanimelist.net/anime/32271/Dies_Irae
11787,Toriko: Barbarian Ivy wo Hokaku Seyo!,Special shown at the Jump Super Anime Tour in 2010.,"['Action', 'Super Power', 'Adventure', 'Comedy', 'Shounen']","Oct 23, 2010",1.0,2359,7546,4974.0,6.73,https://cdn.myanimelist.net/images/anime/13/32953.jpg,https://myanimelist.net/anime/11787/Toriko__Barbarian_Ivy_wo_Hokaku_Seyo
13435,Taka no Tsume NEO Announcement Movie,"A 3-minute trailer of the new TV series, Eagle Talon NEO, and the new ONA series, himitsukesshatakanotsume.jp, with original footage.","['Comedy', 'Parody', 'Super Power']","Mar 14, 2012",1.0,260,12554,10685.0,5.15,https://cdn.myanimelist.net/images/anime/6/37617.jpg,https://myanimelist.net/anime/13435/Taka_no_Tsume_NEO_Announcement_Movie
21335,Double Circle,"""Double Circle"" means the community which evolves infinitely by the energy and ICT in the smart community project. 
People who live in Kawasaki become a hero, and beat an enemy who steals near from the time-stopped world to the evolving town Kawasaki. 
 
(Source: Official website)","['Sci-Fi', 'Super Power']","Dec 19, 2013 to Sep 26, 2014",6.0,4999,5757,10955.0,4.94,https://cdn.myanimelist.net/images/anime/6/56319.jpg,https://myanimelist.net/anime/21335/Double_Circle
24075,Persona 4 the Golden Animation,"Spring. Far from the city, time flows peacefully in this rural town. As the cherry blossoms scatter in the wind, a young man named Yu Narukami steps off the train at Yasoinaba Station. Yu has come to this town, where his uncle lives, for family reasons; he will be transferring into the local high school, Yasogami High. And so begins his school life... The shopping mall after school. A series of murders taking place in town. The Midnight Channel, airing late at night.... What lies in store for Yu and his friends ‘this time around? 
 
(Source: Aniplex USA)","['Sci-Fi', 'Adventure', 'Mystery', 'Super Power', 'Supernatural', 'School']","Jul 11, 2014 to Sep 26, 2014",12.0,59517,1683,5099.0,6.7,https://cdn.myanimelist.net/images/anime/3/63251.jpg,https://myanimelist.net/anime/24075/Persona_4_the_Golden_Animation
