uid,title,synopsis,genre,aired,episodes,members,popularity,ranked,score,img_url,link
267,Gungrave,"Brandon Heat and Harry MacDowel, two friends so close they could be called brothers, receive an abrupt and violent reminder one fateful day of how appallingly merciless the world around them can be. Their whole lives before then were simple and easygoing, consisting largely of local brawls, seducing women, and committing petty theft to make a living and pass the time. What they failed to realize is that in this cruel world, happiness is fleeting, and change is inevitable. 
 
Enter Millennion, the largest and most infamous mafia syndicate in the area, which accepts Brandon and Harry into their ranks and starts them at the bottom of the food chain. Harry has ambitions to ascend the ranks and one day replace Big Daddy as the supreme leader of Millennion, while Brandon only wishes to support his friend and appease Big Daddy who has taken custody of the woman Brandon loves. 
 
Based off the third-person shooter video game under the same name,  Gungrave  is an epic story of friendship, betrayal, and avarice that spans the course of several years, ultimately tying back to the gripping and foreboding first episode, all the while building up to the story's thrilling conclusion. 
 
[Written by MAL Rewrite]","['Action', 'Drama', 'Sci-Fi', 'Seinen', 'Super Power']","Oct 7, 2003 to Mar 30, 2004",26.0,137057,812,727.0,7.89,https://cdn.myanimelist.net/images/anime/11/75724.jpg,https://myanimelist.net/anime/267/Gungrave
6768,Code Geass: Hangyaku no Lelouch R2 Special Edition - Zero Requiem,An OVA summarizing all 25 episodes of season 2.,"['Action', 'Military', 'Super Power', 'Mecha']","Jul 24, 2009",1.0,34345,2372,723.0,7.89,https://cdn.myanimelist.net/images/anime/7/15968.jpg,https://myanimelist.net/anime/6768/Code_Geass__Hangyaku_no_Lelouch_R2_Special_Edition_-_Zero_Requiem
17267,Futari wa Milky Holmes,"Fans of the Milky Holmes detectives, Kazumi and Alice, decide to form their own detective unit, calling themselves ""Feathers."" 
 
(Source: ANN)","['Comedy', 'Mystery', 'Super Power']","Jul 13, 2013 to Sep 28, 2013",12.0,8523,4632,8880.0,5.83,https://cdn.myanimelist.net/images/anime/11/51931.jpg,https://myanimelist.net/anime/17267/Futari_wa_Milky_Holmes
8316,Kawasaki Frontale x Tentai Senshi Sunred,A collaboration between Tentai Senshi Sunred and the J. League football team Kawasaki Frontale.  The members of the team appeared in these specials and voiced themselves.,"['Comedy', 'Parody', 'Seinen', 'Sports', 'Super Power']","Feb 6, 2009 to Feb 27, 2009",4.0,517,10920,8729.0,5.88,https://cdn.myanimelist.net/images/anime/13/75005.jpg,https://myanimelist.net/anime/8316/Kawasaki_Frontale_x_Tentai_Senshi_Sunred
38480,Toaru Kagaku no Accelerator,"Academy City stands at the forefront of scientific and technological progress, best known for their development of espers: those capable of wielding superhuman abilities that alter the rules of reality. The most powerful among them are the Level 5s, and the one known as Accelerator reigns supreme, even after being weakened by a severe brain injury. By his side is the young girl known as Last Order, whom despite his cold demeanor, he holds closely and vows to protect at all costs. 
 
Though Accelerator may be recovering from his injury, the dark side of Academy City never rests, and so he finds himself unwillingly caught up in the midst of a new conflict. When a mysterious young woman approaches Accelerator in pursuit of Last Order, the highest-ranked esper is confronted by a venomous organization that has taken root in Anti-Skill, Academy City's peacekeeping organization. With dangerous forces on the move that threaten to put Last Order and her sisters at risk, the self-proclaimed villain prepares to step into the darkness once again. 
 
[Written by MAL Rewrite] 
","['Fantasy', 'School', 'Super Power', 'Supernatural']","Jul 12, 2019 to Sep 27, 2019",12.0,94607,1162,3241.0,7.14,https://cdn.myanimelist.net/images/anime/1160/99995.jpg,https://myanimelist.net/anime/38480/Toaru_Kagaku_no_Accelerator
30137,Big Order,"The story centers on an introverted high school student named Eiji Hoshimiya with a huge secret—he wished for the destruction of the world when he was younger. Fairies give certain people special powers called Orders, and what Order Users can do with their power depends on their wishes. Ten years after the Great Destruction, Eiji struggles to come to terms with his immense power. 
 
(Source: ANN)","['Action', 'Super Power', 'Shounen']","Oct 3, 2015",1.0,28977,2626,8682.0,5.89,https://cdn.myanimelist.net/images/anime/12/78945.jpg,https://myanimelist.net/anime/30137/Big_Order
29758,Taboo Tattoo,"Seigi, a martial arts trained middle schooler, often feels driven to protect the weaker people around him. One day, he defends a homeless man against some punks, and the man gives him a strange tattoo on his palm in return. The tattoo is a secret weapon produced in the arms race between America and the Serinistan Kingdom. 
 
Seigi finds himself in over his head when a powerful girl, using the same secret weapon, violently pursues him in order to retrieve it. His skill at martial arts may not be enough to keep him alive, but will he be able to learn how to trigger the power of his tattoo in time? 
 
(Source: MU)","['Action', 'Mystery', 'Comedy', 'Super Power', 'Supernatural', 'Martial Arts', 'Seinen']","Jul 5, 2016 to Sep 20, 2016",12.0,180111,602,8673.0,5.9,https://cdn.myanimelist.net/images/anime/12/80197.jpg,https://myanimelist.net/anime/29758/Taboo_Tattoo
8196,Kawasaki Frontale x Tentai Senshi Sunred 2nd Season,The second collaboration between Kawasaki Frontale and Tentai Senshi Sunred.,"['Comedy', 'Parody', 'Seinen', 'Sports', 'Super Power']","Mar 5, 2010",1.0,450,11223,8625.0,5.91,https://cdn.myanimelist.net/images/anime/3/21809.jpg,https://myanimelist.net/anime/8196/Kawasaki_Frontale_x_Tentai_Senshi_Sunred_2nd_Season
7953,Defend Love,"The mysterious alter ego of Amuro gets sent to the first Gundam verse. There she meets Mobile Suit Gundam protagonist Amuro Ray and a battle ensues.  
","['Adventure', 'Fantasy', 'Magic', 'Mecha', 'Romance', 'Super Power', 'Supernatural', 'Music', 'Sci-Fi']","Dec 15, 2009",1.0,1670,8353,8619.0,5.91,https://cdn.myanimelist.net/images/anime/12/19470.jpg,https://myanimelist.net/anime/7953/Defend_Love
3398,Shin Hurricane Polymar,Remake of old superhero show of the same name.,"['Action', 'Martial Arts', 'Super Power', 'Sci-Fi']","Sep 21, 1996 to Feb 21, 1997",2.0,1339,8892,8603.0,5.92,https://cdn.myanimelist.net/images/anime/4/12971.jpg,https://myanimelist.net/anime/3398/Shin_Hurricane_Polymar
35044,Tu Bian Ying Xiong Leaf,"Following the first season's gag action theme, the second season titled  To Be Heroine  features an original story and a new set of characters. 
 
You is about to leave home when she suddenly enters an incredible world. Appearing in front of her is an eight-year-old naked boy, and before she could even grasp the situation, she's attacked by assassins from a mafia group who were chasing the young boy. What was even more unrealistic for You was that the leader of this mafia was another assassin's attack. 
 
Who are those naked kids, why did her shoe turn into a warrior and above all, what kind of world did eight-year-old boy come from? Just like the first one, he's also almost naked! While trying to escape from the attackers, You loses one of her shoes and by a strange kind of magic, her shoe turned into a warrior who was able to save her by blocking the You enter? 
 
(Source: MAL News)","['Comedy', 'Super Power']","Apr 14, 2018 to Jul 6, 2018",12.0,18120,3361,3208.0,7.15,https://cdn.myanimelist.net/images/anime/1552/93084.jpg,https://myanimelist.net/anime/35044/Tu_Bian_Ying_Xiong_Leaf
2321,Giant Robo the Animation: Chikyuu ga Seishi Suru Hi,"In a future to come humanity enjoys a new age of prosperity thanks to Dr. Shizuma's invention of a revolutionary renewable energy source: the Shizuma Drive. But this peace is threatened by Big Fire, a cabal seeking world domination. Against Big Fire the International Police Organisation dispatches a collection of superpowered warriors and martial artists, together with Daisaku Kusama, inheritor and master of Earth's most powerful robot, Giant Robo.  
 
By capturing an abnormal Shizuma Drive which is essential to Big Fire's plans the IPO ignites a desperate conflict between the two groups. The coming battle will test Daisaku's resolve to the utmost, reveal the ghastly truth behind the creation of the Shizuma Drive, and bring human civilization to its knees! 
 
Giant Robo is a character-driven adventure in a retro-futuristic setting, drawing on influences from opera, kung-fu cinema, wuxia stories and classic mecha anime. It incorporates characters from the works of the manga author Mitsuteru Yokoyama but it is designed to be a stand-alone story.","['Action', 'Sci-Fi', 'Super Power', 'Drama', 'Mecha', 'Shounen']","Jul 23, 1992 to Jan 25, 1998",7.0,18602,3310,711.0,7.9,https://cdn.myanimelist.net/images/anime/12/27657.jpg,https://myanimelist.net/anime/2321/Giant_Robo_the_Animation__Chikyuu_ga_Seishi_Suru_Hi
1268,Aquarian Age: Saga II - Don't Forget Me...,"During the chaotic period known in Western astrology as the Aquarian Age, the alien ERASER fleet attacks Earth, ravaging cities. However, a counteroffensive is launched. The four factions—ARAYASHIKI, WIZDOM, DARKLORE, and E.G.O.—who have been fighting each other for control of Earth, join forces to defeat the ERASERS. 
 
In the aftermath, Earth is placed under the unified rule of the POLESTAR EMPIRE. However, peace is shattered when the EMPIRE begins to use forbidden magic. These dark powers cause dimensional rifts around the world and once again plunge Earth into chaos and warfare. 
 
(Source: AniDB)","['Action', 'Super Power', 'Drama']","Nov 21, 2003",1.0,2891,7088,8547.0,5.93,https://cdn.myanimelist.net/images/anime/3/61595.jpg,https://myanimelist.net/anime/1268/Aquarian_Age__Saga_II_-_Dont_Forget_Me
1493,Project ARMS: The 2nd Chapter,"The 2nd Chapter continues the story of Ryo Takatsuki and his companions' quest to discover the secret of the mysterious A.R.M.S. they all possess and what the future may hold for them. They now know where the answers lie but to get to them, they must fight a desperate fight of survival against a powerful military corporation that wants their secrets no matter what the cost. 
 
(Source: AniDB)","['Action', 'Fantasy', 'Martial Arts', 'Super Power', 'School']","Oct 6, 2001 to Mar 30, 2002",26.0,4452,6021,3197.0,7.15,https://cdn.myanimelist.net/images/anime/3/72859.jpg,https://myanimelist.net/anime/1493/Project_ARMS__The_2nd_Chapter
10250,Ultra B,"One night, Michio chases a UFO to see where it lands. He is taken inside it and encounters a mysterious baby, Ultra B. Soon reveals that he has superpowers when he moves in with Michio's family. 
 
(Source: The Anime Encyclopedia)","['Comedy', 'Super Power']","Apr 5, 1987 to Mar 27, 1989",119.0,350,11821,8519.0,5.95,https://cdn.myanimelist.net/images/anime/2/28227.jpg,https://myanimelist.net/anime/10250/Ultra_B
1619,Negima!? Haru Special!?,"Sometime after all the events which took place during Negi's first year as a teacher, Class 2-A goes on a school trip to a beautiful island for Spring break. Everything is fine now, but troubles continue for Negi, because he's still the main atraction of the class. But he has something else to worry about, Asuna is angry at him because he told her she had nothing to do with his studies as a wizard. During the trip, the situation gets intense as Asuna's friends try to help Negi make up with her. 
 
(Source: ANN)","['Ecchi', 'Fantasy', 'Magic', 'Comedy', 'Harem', 'Romance', 'Super Power', 'Shounen']","Oct 25, 2006",1.0,16938,3470,3193.0,7.15,https://cdn.myanimelist.net/images/anime/9/23632.jpg,https://myanimelist.net/anime/1619/Negima_Haru_Special
21603,Mekakucity Actors,"On the hot summer day of August 14, Shintarou Kisaragi is forced to leave his room for the first time in two years. While arguing with the cyber girl Ene who lives in his computer, Shintarou Kisaragi accidentally spills soda all over his keyboard. Though they try to find a replacement online, most stores are closed due to the Obon festival, leaving them with no other choice but to visit the local department store. Venturing outside makes Shintarou extremely anxious, but the thought of living without his computer is even worse. It's just his luck that on the day he finally goes out, he's caught in a terrifying hostage situation. 
 
Luckily, a group of teenagers with mysterious eye powers, who call themselves the ""Mekakushi Dan,"" assist Shintarou in resolving the situation. As a result, he is forced to join their group, along with Ene. Their abilities seem to be like pieces of a puzzle, connecting one another, and as each member's past is unveiled, the secret that ties them together is slowly brought to light. 
 
[Written by MAL Rewrite]","['Sci-Fi', 'Comedy', 'Super Power', 'Supernatural', 'Romance']","Apr 13, 2014 to Jun 29, 2014",12.0,320626,303,3190.0,7.15,https://cdn.myanimelist.net/images/anime/11/61519.jpg,https://myanimelist.net/anime/21603/Mekakucity_Actors
3630,Miracle Shoujo Limit-chan,"As a result of a traffic accident, Limit-chan is reborn as a cyborg and is given three types of supernatural powers. However, there is a catch: if she uses too much of them, her life will come to an end. 
 
(Source: ANN)","['Comedy', 'Magic', 'School', 'Sci-Fi', 'Shoujo', 'Super Power']","Oct 1, 1973 to Mar 25, 1974",25.0,480,11089,8482.0,5.96,https://cdn.myanimelist.net/images/anime/2/17491.jpg,https://myanimelist.net/anime/3630/Miracle_Shoujo_Limit-chan
37151,Marvel Future Avengers 2nd Season,Second season of  Marvel Future Avengers .,"['Action', 'Super Power', 'Kids']","Jul 30, 2018 to Oct 22, 2018",13.0,541,10842,8390.0,5.99,https://cdn.myanimelist.net/images/anime/1135/96838.jpg,https://myanimelist.net/anime/37151/Marvel_Future_Avengers_2nd_Season
678,Shadow Skill: Eigi,"In the land of Kuruda, warriors with magical powers and incredible fighting skills battle for the ultimate prize: the title of Sevaar, the strongest warrior in the land. Elle Ragu, nicknamed Shadow Skill, is the newest Sevaar to emerge, but that doesn't make her life any easier. Teaching her ""little brother,"" Gau, how to be a warrior, fending off assassins from other kingdoms and thwarting enemy invasions is hard enough, but her biggest challenge will be paying off her drinking debts.  
 
(Source: ANN)","['Adventure', 'Fantasy', 'Magic', 'Martial Arts', 'Super Power', 'Drama', 'Shounen']","Jul 3, 1998 to Dec 25, 1998",26.0,10480,4251,3106.0,7.17,https://cdn.myanimelist.net/images/anime/4/61189.jpg,https://myanimelist.net/anime/678/Shadow_Skill__Eigi
32248,Masamune Datenicle,"The coming-of-age battle story will center on the famous 17th-century Japanese warlord Date Masamune when he was young. The Date clan took its name from the Date region of the former Mutsu province, which comprises part of the modern-day city of Date. 
 
The anime will be the first in the city's ""Kirari na Wonder Project"" (Twinkling Wonder Project), which aims to highlight tourist attractions and the appeal of the region. 
 
Gainax's newly founded Fukushima studio will work on the anime, and will complete it at the end of March. The anime will have a private screening in April and will also screen in anime events and be posted online. 
 
(Source: ANN)","['Action', 'Historical', 'Samurai', 'Super Power']","May 2, 2016 to ?",,2783,7164,8360.0,6.0,https://cdn.myanimelist.net/images/anime/7/83821.jpg,https://myanimelist.net/anime/32248/Masamune_Datenicle
21013,Marvel Disk Wars: The Avengers,"The story will revolve around how the Avengers—Iron Man, Captain America, Thor, and the Hulk together with the help of Spider-Man and a group of teens—will harness their respective fighting skills and superhuman powers to foil Loki's scheme to take over the world.  Marvel Disk Wars: The Avengers  will target boys in the 6-12 age group. 
 
(Source: Marvel)","['Action', 'Kids', 'Super Power']","Apr 2, 2014 to Mar 25, 2015",51.0,6097,5319,8359.0,6.0,https://cdn.myanimelist.net/images/anime/13/56857.jpg,https://myanimelist.net/anime/21013/Marvel_Disk_Wars__The_Avengers
8493,Gegege no Kitarou: Kitarou no Yuurei Densha,Kitarou and the ghost train.,"['Adventure', 'Super Power', 'Demons', 'Supernatural']","Mar 20, 1999",1.0,495,11027,8412.0,5.98,https://cdn.myanimelist.net/images/anime/12/22651.jpg,https://myanimelist.net/anime/8493/Gegege_no_Kitarou__Kitarou_no_Yuurei_Densha
7175,Himitsukessha Taka no Tsume Countdown,The second season of Eagle Talon.,"['Comedy', 'Parody', 'Super Power']","Oct 7, 2009 to Dec 23, 2009",11.0,371,11683,8419.0,5.98,https://cdn.myanimelist.net/images/anime/9/82798.jpg,https://myanimelist.net/anime/7175/Himitsukessha_Taka_no_Tsume_Countdown
478,Sousei no Aquarion,"Once upon a time, a race known as the Shadow Angels attacked Earth to harvest the life force of all those who inhabited the planet. Thanks to some outrageous miracle, the Shadow Angels went dormant, and humanity was able to live another 12,000 years without fearing their presence. But 11 years after a catastrophe dubbed the  Holy Genesis  brought ruin to the Earth, the Shadow Angels were stirred from their slumber and resumed the attacks once more. 
 
To give humanity somewhat of a chance, an organization known as DEAVA was formed, and use of a robotic weapon named Aquarion has been authorized. In order for the Aquarion to be brought to full power, three pilots must combine their hearts, bodies, and souls into one—a feat few can hope to accomplish. Thus, the search for so-called 'Element Users' was prioritised, hoping to ensure humanity's future. 
 
 Sousei no Aquarion  follows the story of Apollo, a near-feral young man brought up in poverty, who is believed to be a legendary hero reincarnated. After his best friend is taken by the Shadow Angels, Apollo chooses to become an Aquarion pilot. Will he be able to turn the tides of the war, and free humanity from the threat of the Shadow Angels for once and for all?","['Action', 'Mecha', 'Romance', 'Super Power', 'Supernatural', 'Sci-Fi']","Apr 5, 2005 to Sep 27, 2005",26.0,61115,1645,3150.0,7.16,https://cdn.myanimelist.net/images/anime/11/76291.jpg,https://myanimelist.net/anime/478/Sousei_no_Aquarion
20035,Toaru Majutsu no Index-tan Movie: Endymion no Kiseki - Ga Attari Nakattari,Bonus animation featuring Index-tan included with the BD special edition of the  Toaru Majutsu no Index: Endymion no Kiseki  movie.,"['Action', 'Magic', 'Sci-Fi', 'Super Power']","Aug 28, 2013",1.0,17541,3414,3205.0,7.15,https://cdn.myanimelist.net/images/anime/9/53541.jpg,https://myanimelist.net/anime/20035/Toaru_Majutsu_no_Index-tan_Movie__Endymion_no_Kiseki_-_Ga_Attari_Nakattari
5691,Rekka no Honoo: Final Burning,"This episode explains why the title of the series is ""Flame of Recca"". The things that happened in this short OAV was in the last volume, volume 33, of the tankoubon of Flame of Recca.","['Action', 'Adventure', 'Magic', 'Martial Arts', 'School', 'Sci-Fi', 'Super Power']","Jun 10, 2004",1.0,5314,5612,3318.0,7.12,https://cdn.myanimelist.net/images/anime/13/11830.jpg,https://myanimelist.net/anime/5691/Rekka_no_Honoo__Final_Burning
461,One Piece Movie 3: Chinjuu-jima no Chopper Oukoku,"The crew comes upon Crown Island where the animals can talk and they makes Chopper their new king. But there are human hunters there also looking for the legendary horns that will give the person who consumes it immense power. Luffy and friends must stop them from destroying this animal kingdom. 
 
(Source: ANN)","['Action', 'Adventure', 'Comedy', 'Super Power', 'Fantasy', 'Shounen']","Mar 2, 2002",1.0,50963,1869,3473.0,7.08,https://cdn.myanimelist.net/images/anime/8/6937.jpg,https://myanimelist.net/anime/461/One_Piece_Movie_3__Chinjuu-jima_no_Chopper_Oukoku
24347,Inazuma Eleven: Chou Jigen Dream Match,A new movie featuring a match between fan-voted members of the Inazuma Best Eleven team and the special Battle Eleven team.,"['Sports', 'Super Power', 'Shounen']","Jun 13, 2014",1.0,5581,5515,3599.0,7.05,https://cdn.myanimelist.net/images/anime/3/62875.jpg,https://myanimelist.net/anime/24347/Inazuma_Eleven__Chou_Jigen_Dream_Match
1492,Project ARMS,"A boy gets involved in an accident when in kindergarten, horribly damaging his arm, but the doctors somehow manage to save it. Now, several years later, his arm seems to be becoming the focus of strange events as it turns out to be more than a normal arm. Meanwhile, a secret organizations is out to get hold of him and the power he possess. ","['Action', 'Martial Arts', 'Super Power']","Apr 7, 2001 to Sep 29, 2001",26.0,9933,4359,3566.0,7.06,https://cdn.myanimelist.net/images/anime/1197/92994.jpg,https://myanimelist.net/anime/1492/Project_ARMS
10659,Naruto Soyokazeden Movie: Naruto to Mashin to Mitsu no Onegai Dattebayo!!,"Naruto discovers a genie's bottle while he and the gang are at a genin grill party. When everyone finds out about the genie's ability to grant wishes, the ultimate chase begins. 
 
(Source: AniDB)","['Action', 'Comedy', 'Martial Arts', 'Shounen', 'Super Power']","Jul 31, 2010",1.0,34383,2370,3563.0,7.06,https://cdn.myanimelist.net/images/anime/10/31573.jpg,https://myanimelist.net/anime/10659/Naruto_Soyokazeden_Movie__Naruto_to_Mashin_to_Mitsu_no_Onegai_Dattebayo
6624,Kara no Kyoukai Remix: Gate of Seventh Heaven,"In August of 1995, Mikiya Kokutou meets a young kimono-clad woman named Shiki Ryougi. When he finds out that they go to the same school, he attempts to befriend her. Though her upbringing is unconventional and she herself is strange, Mikiya is not deterred, and Shiki gradually opens up to him. But Mikiya's life will be changed forever by this simple meeting, and in ways that he never imagined, as he begins to see a deadly side to his new friend... 
 
[Written by MAL Rewrite]","['Action', 'Mystery', 'Romance', 'Super Power', 'Thriller']","Mar 14, 2009",1.0,33736,2396,1277.0,7.65,https://cdn.myanimelist.net/images/anime/11/15175.jpg,https://myanimelist.net/anime/6624/Kara_no_Kyoukai_Remix__Gate_of_Seventh_Heaven
20,Naruto,"Moments prior to Naruto Uzumaki's birth, a huge demon known as the Kyuubi, the Nine-Tailed Fox, attacked Konohagakure, the Hidden Leaf Village, and wreaked havoc. In order to put an end to the Kyuubi's rampage, the leader of the village, the Fourth Hokage, sacrificed his life and sealed the monstrous beast inside the newborn Naruto. 
 
Now, Naruto is a hyperactive and knuckle-headed ninja still living in Konohagakure. Shunned because of the Kyuubi inside him, Naruto struggles to find his place in the village, while his burning desire to become the Hokage of Konohagakure leads him not only to some great new friends, but also some deadly foes. 
 
[Written by MAL Rewrite]","['Action', 'Adventure', 'Comedy', 'Super Power', 'Martial Arts', 'Shounen']","Oct 3, 2002 to Feb 8, 2007",220.0,1280914,9,670.0,7.93,https://cdn.myanimelist.net/images/anime/13/17405.jpg,https://myanimelist.net/anime/20/Naruto
5231,Inazuma Eleven,"While other schools in Japan compete for the title of being the best soccer team in the country, Raimon Middle School's soccer club,  Inazuma Eleven , struggles to rise from the verge of being disbanded. The grandson of Inazuma Eleven's first generation goalkeeper and captain of the team, Mamoru Endou, takes the challenge of kicking the long neglected club back into shape. To do this, he'll need a little help and more than a little luck. 
 
Mamoru Endou finds hope in the hands of Shuuya Gouenji, a brilliant young player who has given up on soccer. Mamoru is determined to get Shuuya and other new recruits to join his team, no matter what the cost. Is his passion and determination enough to treat the ailing club? Or is there no more hope for the team?","['Sports', 'Super Power', 'Shounen']","Oct 5, 2008 to Apr 27, 2011",127.0,97116,1137,1274.0,7.65,https://cdn.myanimelist.net/images/anime/3/17917.jpg,https://myanimelist.net/anime/5231/Inazuma_Eleven
10793,Guilty Crown,"Japan, 2039. Ten years after the outbreak of the ""Apocalypse Virus,"" an event solemnly regarded as ""Lost Christmas,"" the once proud nation has fallen under the rule of the GHQ, an independent military force dedicated to restoring order. Funeral Parlor, a guerilla group led by the infamous Gai Tsutsugami, act as freedom fighters, offering the only resistance to GHQ's cruel despotism. 
  
Inori Yuzuriha, a key member of Funeral Parlor, runs into the weak and unsociable Shuu Ouma during a crucial operation, which results in him obtaining the ""Power of Kings""—an ability which allows the wielder to draw out the manifestations of an individual's personality, or ""voids."" Now an unwilling participant in the struggle against GHQ, Shuu must learn to control his newfound power if he is to help take back Japan once and for all. 
  
 Guilty Crown  follows the action-packed story of a young high school student who is dragged into a war, possessing an ability that will help him uncover the secrets of the GHQ, Funeral Parlor, and Lost Christmas. However, he will soon learn that the truth comes at a far greater price than he could have ever imagined. 
 
[Written by MAL Rewrite]","['Action', 'Sci-Fi', 'Super Power', 'Drama', 'Romance', 'Mecha']","Oct 14, 2011 to Mar 23, 2012",22.0,781239,57,1271.0,7.65,https://cdn.myanimelist.net/images/anime/8/33713.jpg,https://myanimelist.net/anime/10793/Guilty_Crown
38489,Feng Yu Zhou,,"['Action', 'Adventure', 'Comedy', 'Historical', 'Super Power', 'Demons', 'Drama', 'Fantasy']","Aug 3, 2018",1.0,453,11240,3546.0,7.06,https://cdn.myanimelist.net/images/anime/1090/95412.jpg,https://myanimelist.net/anime/38489/Feng_Yu_Zhou
