uid,title,synopsis,genre,aired,episodes,members,popularity,ranked,score,img_url,link
6919,X-Men,"The X-Men are reunited following the death of a teammate, and are summoned by Charles Xavier to Japan following the abduction of Hisako Ichiki (Armor). There, they confront the U-Men, a lunatic cult that steals and transplants mutant organs to further strengthen their own army, and the battle for justice is on. 
 
(Source: Marvel)","['Action', 'Drama', 'Super Power']","Apr 1, 2011 to Jun 24, 2011",12.0,20104,3186,6424.0,6.43,https://cdn.myanimelist.net/images/anime/8/30014.jpg,https://myanimelist.net/anime/6919/X-Men
38425,Ikkitousen: Western Wolves,,"['Action', 'Ecchi', 'Martial Arts', 'School', 'Seinen', 'Super Power']","Jan 3, 2019 to Feb 27, 2019",3.0,6212,5294,6389.0,6.43,https://cdn.myanimelist.net/images/anime/1914/95106.jpg,https://myanimelist.net/anime/38425/Ikkitousen__Western_Wolves
3900,Ougon Bat,"A golden warrior wearing a cape and a scepter, Ougon Bat was a protector spirit  from Atlantis reanimated by a scientist and his friends (specially the sweet Marie) from his tomb covered in hieroglyphics. His entry was heralded by a golden bat and a sinister laugh and he would put good use of his super powers to combat the evil forces of Dr. Zero.","['Action', 'Sci-Fi', 'Super Power']","Apr 1, 1967 to Mar 23, 1968",52.0,997,9521,6355.0,6.44,https://cdn.myanimelist.net/images/anime/2/28619.jpg,https://myanimelist.net/anime/3900/Ougon_Bat
27629,Tantei Kageki Milky Holmes TD,"There have been many cases of stolen songs happening among the idols in Yokohama District recently. Even super idol Marine Amagi's hit song ""Kiseki no Uta"" was taken away. At the request of Marine, the Milky Holmes team starts investigating the case. 
 
(Source: Crunchyroll)","['Comedy', 'Mystery', 'Super Power']","Jan 3, 2015 to Mar 28, 2015",12.0,6946,5032,6277.0,6.46,https://cdn.myanimelist.net/images/anime/5/66891.jpg,https://myanimelist.net/anime/27629/Tantei_Kageki_Milky_Holmes_TD
39935,Ultraman 2,Second season of  Ultraman .,"['Action', 'Sci-Fi', 'Super Power', 'Seinen']",Not available,13.0,2044,7938,,,https://cdn.myanimelist.net/images/anime/1680/101395.jpg,https://myanimelist.net/anime/39935/Ultraman_2
38481,Toaru Kagaku no Railgun T,Third season of  Toaru Kagaku no Railgun .,"['Action', 'Sci-Fi', 'Super Power']","Jan 10, 2020 to ?",,45336,2032,,,https://cdn.myanimelist.net/images/anime/1819/103287.jpg,https://myanimelist.net/anime/38481/Toaru_Kagaku_no_Railgun_T
40028,Shingeki no Kyojin The Final Season,Final Season of  Shingeki no Kyojin .,"['Action', 'Military', 'Mystery', 'Super Power', 'Drama', 'Fantasy', 'Shounen']","Oct, 2020 to ?",,72084,1514,,,https://cdn.myanimelist.net/images/anime/1873/103180.jpg,https://myanimelist.net/anime/40028/Shingeki_no_Kyojin_The_Final_Season
39893,Muteking the Dancing Hero,,"['Action', 'Comedy', 'Kids', 'Magic', 'Mecha', 'Sci-Fi', 'Shounen', 'Super Power']",2020 to ?,,108,15244,,,https://cdn.myanimelist.net/images/anime/1217/101179.jpg,https://myanimelist.net/anime/39893/Muteking_the_Dancing_Hero
33852,Mekakucity Reload,,"['Sci-Fi', 'Comedy', 'Super Power', 'Supernatural', 'Romance']",Not available,,29967,2570,,,https://cdn.myanimelist.net/images/anime/2/81505.jpg,https://myanimelist.net/anime/33852/Mekakucity_Reload
40075,Koi to Producer: EVOL×LOVE,"A girl inherits a company that is almost bankrupt from her late father. Lacking the funds, she must now become the producer herself in order to save the company from collapse. 
During her work, she meets four boys—financial expert Zen, the idol Kira, police officer Haku, and leading neuroscientist Simon—and is suddenly involved with the conspiracies and mysteries over the existence of special powers known as ""Evol."" 
 
(Source: MAL News)","['Music', 'Slice of Life', 'Super Power', 'Romance', 'Shoujo']",Not available,,644,10575,,,https://cdn.myanimelist.net/images/anime/1525/101976.jpg,https://myanimelist.net/anime/40075/Koi_to_Producer__EVOL%C3%97LOVE
38136,Zhu Zhu Xia: Zhong Ji Jue Zhan - Qian Ye Pian,"A prequel TV series setting up for the  Zhu Zhu Xia: Zhong Ji Jue Zhan  feature film.  
 
G.G. Bond's father while exploring ruins gets sucked into a dimension of evil through the Dark Gate. He is bestowed power and knowledge and becomes corrupted as the King of Darkness. Ancient monsters are sent through the cracks of the gate to attack G.G. Bond and his team as the 5 elemental powers are stronger than the King of Darkness. By weakening the team, only then can the King of Darkness forcibly open the gate to unless a reign of terror on the Fairy Tale world.","['Sci-Fi', 'Super Power', 'Kids']","Jun 10, 2015 to Aug, 2015",52.0,76,15822,14657.0,4.86,https://cdn.myanimelist.net/images/anime/1480/93363.jpg,https://myanimelist.net/anime/38136/Zhu_Zhu_Xia__Zhong_Ji_Jue_Zhan_-_Qian_Ye_Pian
38137,Zhu Zhu Xia: Zhong Ji Jue Zhan,"G.G. Bond and his team have eliminated all monster threats. So they have been using a virtual reality simulator to stay on top in case of a threat. In this simulator, G.G. Bond is reunited with his father. But unbeknownst to him, his father is the King of Darkness and merges virtual time and space with reality. Unable to tell apart illusions with realness, the King of Darkness attacks while the heroes are confused.","['Sci-Fi', 'Super Power', 'Kids']","Jul 10, 2015",1.0,71,15888,14656.0,4.68,https://cdn.myanimelist.net/images/anime/1304/93364.jpg,https://myanimelist.net/anime/38137/Zhu_Zhu_Xia__Zhong_Ji_Jue_Zhan
38120,Zhu Zhu Xia: Yong Chuang Weilai Cheng,"This time, G.G. Bond is sent to 2080 to find a world divided, where the poor live on a lower, polluted level. He finds that his primary school, Parents' Hope School, is about to be taken over by a competitor, Super Technology School. To defend against this, he must win sports competitions to raise funds. 
 
(Source: Wikipedia)","['Sci-Fi', 'Sports', 'Super Power', 'Kids', 'School']","May, 2008 to 2008",40.0,86,15647,14655.0,3.88,https://cdn.myanimelist.net/images/anime/1291/93347.jpg,https://myanimelist.net/anime/38120/Zhu_Zhu_Xia__Yong_Chuang_Weilai_Cheng
38134,Zhu Zhu Xia: Ying Xiong Zhu Shao Nian,"Legend has it that five locks protect the world's magic power, but it accidentally selected a ""nobody"" G.G. Bond as its owner. A terrible man dressed in black is trying to destroy all five locks. He's taller and a strong fighter and seems to know G.G. Bond's every move. When the team is at its last straw, they find out that the man in black is G.G. Bond himself 13 years from the future.  
 
(Source: IMDB)","['Sci-Fi', 'Super Power', 'Kids', 'Magic']","Jan 7, 2017",1.0,73,15853,14653.0,4.71,https://cdn.myanimelist.net/images/anime/1943/93361.jpg,https://myanimelist.net/anime/38134/Zhu_Zhu_Xia__Ying_Xiong_Zhu_Shao_Nian
38127,Zhu Zhu Xia: Wu Ling Shou Wei Zhe,G.G. Bond finally won the appreciation of Princess Crystal and moved to Crystal City. But conspiracy traps lurk in the darkness out to frame G.G. Bond an ruin his good name.,"['Sci-Fi', 'Super Power', 'Kids']","Sep 18, 2015 to Dec, 2015",52.0,77,15807,14650.0,4.64,https://cdn.myanimelist.net/images/anime/1775/93354.jpg,https://myanimelist.net/anime/38127/Zhu_Zhu_Xia__Wu_Ling_Shou_Wei_Zhe
38118,Zhu Zhu Xia: Mo Huan Zhu Luo Ji,"The ""first"" season of  Zhu Zhu Xia , its release format set the pattern and story style for later seasons. 
 
GG Bond was a martial artist pig in a prehistoric world where resources are strained by overpopulation. At the cost of his own life, he entrusted a powerful ""Magic Wisdom Ball"" to Wang Xiaoer that could be used to save the environment. Wang Xiaoer instead used the ball for his own gain. When G.G. Bond is reincarnated and sees what Wang Xiaoer has done, he knows it is up to him to fix the problem, no matter what Wang Xiaoer tries to do to stop him. 
 
(Source: Wikipedia)","['Sci-Fi', 'Super Power', 'Kids', 'Martial Arts']","Jul, 2006 to 2006",20.0,85,15665,14649.0,4.27,https://cdn.myanimelist.net/images/anime/1912/93345.jpg,https://myanimelist.net/anime/38118/Zhu_Zhu_Xia__Mo_Huan_Zhu_Luo_Ji
38129,Zhu Zhu Xia: Meng Xiang Shou Wei Zhe,G.G. Bonds enters the realm of dreams to stop evil's power from growing. They must get the citizens of Crystal City to remember their dreams so that the 5 element powers can recharge.,"['Sci-Fi', 'Super Power', 'Kids']","Oct 28, 2016 to Dec 29, 2016",52.0,80,15751,14648.0,4.5600000000000005,https://cdn.myanimelist.net/images/anime/1141/93356.jpg,https://myanimelist.net/anime/38129/Zhu_Zhu_Xia__Meng_Xiang_Shou_Wei_Zhe
39798,Zhu Zhu Xia: Konglong Riji,"A more educational season of GG Bond. 
 
GG Bond works on cleaning up some fossils at the lab as they'll be used in a museum exhibit. He uses a fossil to create a data coin that is compatible with his special jet. This allows for him to travel back in time to the original animal (a T-Rex) the fossil was made of. While GG Bond is ecstatic to learn about dinosaurs in-person (as well as mine more accurate data for the data coin), he didn't quite realize the danger he'd be in. He successfully gets out of this sticky situation but there's still a lot more dinosaurs he needs to get information on.","['Sci-Fi', 'Historical', 'Super Power', 'Kids']","Apr 29, 2019 to Aug 27, 2019",52.0,65,15992,14647.0,5.33,https://cdn.myanimelist.net/images/anime/1956/100947.jpg,https://myanimelist.net/anime/39798/Zhu_Zhu_Xia__Konglong_Riji
38123,Zhu Zhu Xia: Xingfu Jiuyuan Dui,"If Fairy Land loses happiness, the whole world will fall apart. G.G. Bond teams up with a rescue crew to save the world.","['Sci-Fi', 'Super Power', 'Kids']","Sep, 2012 to ?",52.0,81,15726,14652.0,4.42,https://cdn.myanimelist.net/images/anime/1678/93350.jpg,https://myanimelist.net/anime/38123/Zhu_Zhu_Xia__Xingfu_Jiuyuan_Dui
38119,Zhu Zhu Xia: Wu Xia 2008,"Primary school student G.G. Bond is eager for the 2008 Beijing Olympics when he is dragged back in time to the competitive islander of Olympus. His only hope to return is to recover the ""Keyinuoer” diamond from the dragon who guards it at the peak of Bright Mountain. He can only do this if he wins the island's athletic competitions. He has the power of a super lollipop which enhances his athletic abilities for only a few minutes, but must face up against sports genius Super Qiang if he hopes to ever go home. 
 
(Source: Wikipedia)","['Sci-Fi', 'Historical', 'Sports', 'Super Power', 'Kids']","Jul, 2007 to 2007",20.0,80,15752,14651.0,4.17,https://cdn.myanimelist.net/images/anime/1658/93346.jpg,https://myanimelist.net/anime/38119/Zhu_Zhu_Xia__Wu_Xia_2008
38128,Zhu Zhu Xia: Guang Ming Shou Wei Zhe,"Twin City, as legend has it, is an evil city which was born at the time when Crystal City was created. There is a mirror-like lake above the city which has a horrifying power. It enables people to face the darkest side deep within their hearts. This darkness manifests as the person's opposite. The heroes must send these malicious beings back to their realm before they tear Crystal City apart.","['Kids', 'Sci-Fi', 'Super Power']","Apr 29, 2016 to Aug 24, 2016",52.0,78,15788,14643.0,4.22,https://cdn.myanimelist.net/images/anime/1475/93355.jpg,https://myanimelist.net/anime/38128/Zhu_Zhu_Xia__Guang_Ming_Shou_Wei_Zhe
38140,Zhu Zhu Xia: Fan Wai - Zhi Huanqiu Riji,"Teaming up as an agent squad, GG Bond and his pals travel around the world to help people solve their problems. Although their journeys are full of danger and unknown, these brave agents are highly committed to their missions and never step back. On their way of the global adventure, they can also learn about local cultures and customs, which are accompanied with funny stuff and interesting stories. You never know what they will run into in their next mission... 
 
(Source: Official YouTube channel)","['Sci-Fi', 'Adventure', 'Super Power', 'Kids']","Mar 30, 2018 to May 4, 2018",26.0,71,15886,14642.0,3.9,https://cdn.myanimelist.net/images/anime/1474/93366.jpg,https://myanimelist.net/anime/38140/Zhu_Zhu_Xia__Fan_Wai_-_Zhi_Huanqiu_Riji
38122,Zhu Zhu Xia: Jimu Shijie De Tong Hua,"When GG Bond's grandfather, EE Bond, tries to save the dinosaur from extinction by traveling back 60 million years, he accidentally winds up in the Brick Kingdom, a fairy tale world built by blocks, along with half of the rest of the city. Since they cannot leave, they slowly transform the world with technology like their own. His grandson, GG Bond, follows in his grandfather's footsteps as an Assembler, somebody who can build the blocks of the Brick Kingdom into anything. He uses these skills to fight evil. 
 
(Source: Wikipedia)","['Sci-Fi', 'Super Power', 'Kids', 'Fantasy']","Sep, 2010 to ?",52.0,82,15703,14644.0,4.69,https://cdn.myanimelist.net/images/anime/1250/93349.jpg,https://myanimelist.net/anime/38122/Zhu_Zhu_Xia__Jimu_Shijie_De_Tong_Hua
38135,Zhu Zhu Xia: Fan Wai - Pin Zhuang Tegong Dui,"The first web-season of G.G. Bond, episodes were later televised on a select few TV channels. 
 
This season is meant to be more educational than the main series line. Each episode focuses on 1 country as the cast travels the world solving riddles while learning about the culture. And of course, fighting crime while at it.","['Sci-Fi', 'Adventure', 'Super Power', 'Kids']","Dec 29, 2016 to Jan 4, 2017",26.0,70,15899,14641.0,4.45,https://cdn.myanimelist.net/images/anime/1781/93362.jpg,https://myanimelist.net/anime/38135/Zhu_Zhu_Xia__Fan_Wai_-_Pin_Zhuang_Tegong_Dui
38117,Zhu Zhu Xia: Da Nao Huang Gong,"The series is about the titular character, an intelligent and mischievous pig named G.G. Bond (猪猪侠, meaning ""Pig Hero"") born with superpowers. He is an orphan under the care and custody of Dr. Mihu, his teacher who enjoys inventing different gadgets.  
 
This is considered ""season 0"" due to its short length. Originally it was advertised as a for-TV movie. 
 
(Source: Wikipedia)","['Sci-Fi', 'Super Power', 'Kids']",2005,4.0,77,15806,14640.0,3.79,https://cdn.myanimelist.net/images/anime/1136/93344.jpg,https://myanimelist.net/anime/38117/Zhu_Zhu_Xia__Da_Nao_Huang_Gong
38131,Zhu Zhu Xia: Chao Xing Meng Chong,"Attempting to make GG Bond the partner for Iron Fist, Mr. Mihoo disguised himself as a school teacher, showing GG Bond the charm of interstellar shuttling. GG Bond took his invitation and became an agent. As GG Bond’s pet and mission partner, Iron Fist had the power to absorb everything. His biggest secret was that his stomach linked to the infinite fifth dimension. One day Iron Fist ate the stone of eternal energy. The universe would lose balance without the stone. GG Bond had to enter into Iron Fist’s fifth dimension searching for it. After all adventures and difficulties, he finally brought it out and saved the world. 
 
(Source: Official YouTube channel)","['Sci-Fi', 'Super Power', 'Kids']","May 27, 2017 to Dec 28, 2017",124.0,78,15787,14639.0,4.3,https://cdn.myanimelist.net/images/anime/1127/93358.jpg,https://myanimelist.net/anime/38131/Zhu_Zhu_Xia__Chao_Xing_Meng_Chong
40182,Zhu Zhu Xia: Bukesiyi De Shijie,"A girl has loved GG Bond the little pig hero ever since she was a little child. For GG Bond is nothing more than a children's story. Her overbearing parents pressured her into academics well beyond that of sensibility. As she suffers depression she touches a drawn mural she did of GG Bond on her bedroom wall. It opens a portal and she teleports into GG Bond's world. The worlds start to blur, and things she draws on the wall appear within the other world. Eventually she gets trapped and they have to find a way to get her back home.","['Action', 'Adventure', 'Fantasy', 'Kids', 'Sci-Fi', 'Super Power']","Jul 5, 2019",1.0,69,15935,14638.0,5.0,https://cdn.myanimelist.net/images/anime/1956/102315.jpg,https://myanimelist.net/anime/40182/Zhu_Zhu_Xia__Bukesiyi_De_Shijie
38125,Zhu Zhu Xia: Bian Shen Zhandu,The Kung Fu Team was endowed with the transformation power of the 5 elements. The Fairy World is in danger again and together they must combine the 5 elements to defeat evil.,"['Sci-Fi', 'Super Power', 'Kids', 'Martial Arts']","Aug 10, 2014 to ?",52.0,86,15646,14637.0,4.54,https://cdn.myanimelist.net/images/anime/1119/93352.jpg,https://myanimelist.net/anime/38125/Zhu_Zhu_Xia__Bian_Shen_Zhandu
38124,Zhu Zhu Xia: Bian Shen Xiao Ying Xiong,The Fairy World has been suffering attacks from all sorts of monsters. G.G. Bond by accident becomes a monster and now has to fight against both sides.,"['Sci-Fi', 'Super Power', 'Kids']","Dec, 2013 to ?",52.0,80,15750,14636.0,4.88,https://cdn.myanimelist.net/images/anime/1655/93351.jpg,https://myanimelist.net/anime/38124/Zhu_Zhu_Xia__Bian_Shen_Xiao_Ying_Xiong
36428,Zhan Guo FAN,,"['Super Power', 'Magic', 'Martial Arts', 'Fantasy']","Aug 22, 2016 to Nov 2, 2016",15.0,623,10525,14627.0,6.13,https://cdn.myanimelist.net/images/anime/12/87896.jpg,https://myanimelist.net/anime/36428/Zhan_Guo_FAN
38126,Zhu Zhu Xia: Bai Bian Lian Meng,Will G.G. Bond be able to save Fairy World when his enemy is his father? Or is it a trick? G.G. Bond waivers between his alliance with his fellow warriors and his alliance with his long lost family.,"['Sci-Fi', 'Super Power', 'Kids']","Jan 27, 2015 to Mar 27, 2015",52.0,79,15770,14635.0,4.58,https://cdn.myanimelist.net/images/anime/1580/93353.jpg,https://myanimelist.net/anime/38126/Zhu_Zhu_Xia__Bai_Bian_Lian_Meng
38132,Zhu Zhu Xia: Jiong Jiong Wei Ji,"The first ever theatrical G.G. Bond film. G.G. Bond and his friends have to use environmental protection to save the Fairy Tale planet. Their planet is actually an egg, and the greenhouse gasses from pollution are about to let it hatch. If the eggshell breaks, everyone will die. 
","['Sci-Fi', 'Super Power', 'Kids']","Jun 28, 2012",1.0,68,15936,14646.0,4.36,https://cdn.myanimelist.net/images/anime/1111/93359.jpg,https://myanimelist.net/anime/38132/Zhu_Zhu_Xia__Jiong_Jiong_Wei_Ji
38138,Zhu Zhu Xia: Jing Qiu Xiao Yingxiong,"In honor of the 2018 World Cup, this season of GG Bond focuses on sports team competition, team spirit, and personal growth as they compete in the Meteor League. 
 
","['Sci-Fi', 'Sports', 'Super Power', 'Kids']","May 18, 2018 to Mar 28, 2019",104.0,96,15431,14645.0,5.35,https://cdn.myanimelist.net/images/anime/1773/93369.jpg,https://myanimelist.net/anime/38138/Zhu_Zhu_Xia__Jing_Qiu_Xiao_Yingxiong
38133,Zhu Zhu Xia: Yong Chuang Juren Dao,Jack the Robber loses his magic bean. G.G. Bond and friends plant it and a giant beanstalk grows. Up in the clouds there is a new world called Titan Island. They triggered the Titan's alarm and the bean's vine is severed. The team may not be able to make it back home between fighting off the Titan as well as Jack the Robber's attempt to steal treasure and sabotage the team.,"['Sci-Fi', 'Super Power', 'Kids']","May 31, 2014",1.0,72,15887,14654.0,4.2,https://cdn.myanimelist.net/images/anime/1784/93360.jpg,https://myanimelist.net/anime/38133/Zhu_Zhu_Xia__Yong_Chuang_Juren_Dao
29611,Pa-Pa-Pa the ★ Movie: Perman - Tako de Pon! Ashi wa Pon!,"Dr. Octo who researches octopodes decides to take over the world as he deems the eight legged creatures a more suitable master species than humans. To do this, he takes an idol singer Sumire Hoshino (aka Perman #3) hostage. Mitsuo Suwa (aka Perman #1) likes the idol dearly (as he doesn't know the real identity of his Perman partner) and becomes so angry that he transforms to go rescue her. But fighting a giant octopus is more challenging than it looks! 
 
Screened simultaneously with  Doraemon Movie 25: Nobita no Wan Nyan Jikuudeni  and  Doraemon Anniversary 25 .","['Kids', 'Adventure', 'Comedy', 'Super Power']","Mar 6, 2004",1.0,249,12678,6229.0,6.47,https://cdn.myanimelist.net/images/anime/9/71227.jpg,https://myanimelist.net/anime/29611/Pa-Pa-Pa_the_%E2%98%85_Movie__Perman_-_Tako_de_Pon_Ashi_wa_Pon
198,Speed Grapher,"Ten years after the Bubble War, the dichotomy between the rich and the poor in the world becomes more prominent and Japan is no exception. The rich seek to satisfy their desires and derive pleasure for themselves, and Tokyo has materialized into such a city as a result. Saiga, once a war photographer, works for Hibara Ginza in the capitalist state of Tokyo. He infiltrates the Roppongi Club, a secretive base located in the red light district of the city, to collect information about them. However, he was caught in the process and brought forward to a girl called Kagura who was in the midst of a ritual. His contact with Kagura awakens his special ability: the power to make things explode when photographed. In order to unravel the mystery behind the Roppongi Club and Kagura, Saiga begins his solitary battle.","['Action', 'Mystery', 'Super Power']","Apr 8, 2005 to Sep 30, 2005",24.0,86922,1241,2080.0,7.41,https://cdn.myanimelist.net/images/anime/12/26128.jpg,https://myanimelist.net/anime/198/Speed_Grapher
31050,Cyborg 009 VS Devilman,"After discovering the existence of demons in Tokyo, the original Cyborg crew led by Dr. Gilmore find themselves in conflict with Devilman, a strong demon believed to be in league with the war-profiteering terrorist organisation, Black Ghost. Meanwhile, a bigger threat emerges when Dr. Adams, a Black Ghost scientist unleashes his new line of high teen Cyborg models against 009 and his friends. 
 
(Source: ANN)","['Action', 'Sci-Fi', 'Super Power', 'Demons', 'Supernatural', 'Shounen']","Nov 11, 2015",3.0,8794,4576,6203.0,6.47,https://cdn.myanimelist.net/images/anime/10/76057.jpg,https://myanimelist.net/anime/31050/Cyborg_009_VS_Devilman
9795,Atashin'chi Movie,"In a stormy night, Mikan and Mom were stricken by lightning simultaneously and switched bodies. In the following days, while Mom enjoyed being a student again, Mikan had to fought with house chores. Meanwhile, Yuzuhiko and Dad were busy looking for a way to switch them back. 
 
(Source: ANN)","['Comedy', 'Super Power']","Dec 6, 2003",1.0,472,11123,6198.0,6.46,https://cdn.myanimelist.net/images/anime/12/27153.jpg,https://myanimelist.net/anime/9795/Atashinchi_Movie
38536,Hitori no Shita: The Outcast 3rd Season,Third season of Hitori no Shita: The Outcast.,"['Action', 'Mystery', 'Super Power', 'Psychological', 'Supernatural', 'Drama', 'Martial Arts']",2019 to ?,,6577,5161,,,https://cdn.myanimelist.net/images/anime/1383/95761.jpg,https://myanimelist.net/anime/38536/Hitori_no_Shita__The_Outcast_3rd_Season
1107,Youjuu Toshi,"There is Earth, our familiar world, and then there is the Black World, a parallel dimension that very few people are aware of. For centuries, a pact between the two worlds has been observed to maintain peace, and terms must be negotiated and renewed soon to continue relative harmony. 
 
This time around, there is a militant faction that will stop at nothing to prevent the signing of a new treaty for inter-dimensional peace. Two agents of the elite organization known as the Black guards—defenders of the balance between the two worlds—are charged with insuring the success of the treaty. 
 
Director Yoshiaki Kawajiri (Ninja Scroll) blends stylish eroticism, graphic horror and pulse-pounding action as these two race to consummate the peace treaty in time. 
 
(Source: AniDB)","['Action', 'Adventure', 'Demons', 'Drama', 'Horror', 'Super Power']","Apr 25, 1987",1.0,24170,2902,6195.0,6.48,https://cdn.myanimelist.net/images/anime/2/50021.jpg,https://myanimelist.net/anime/1107/Youjuu_Toshi
9202,Seikon no Qwaser: Jotei no Shouzou,"Based on Ekaterina Kurae's chapter 16 from the manga, and episode 10.5 of the anime.","['Action', 'Super Power', 'Supernatural', 'Ecchi', 'Seinen']","Oct 20, 2010",1.0,20623,3142,6184.0,6.48,https://cdn.myanimelist.net/images/anime/9/27178.jpg,https://myanimelist.net/anime/9202/Seikon_no_Qwaser__Jotei_no_Shouzou
238,Rekka no Honoo,"Most people think that ninjas are a thing of the past, but Rekka Hanabishi wishes otherwise. Although he comes from a family that makes fireworks, he likes to think of himself as a self-styled, modern-day ninja. Sounds like fun, right? Maybe not. Rekka ends up in lots of fights because he once made the bold announcement that if someone can defeat him, he will become their servant. 
 
Then one day, Rekka meets Yanagi Sakoshita, a gentle girl with the ability to heal any wound or injury. Their meeting sets off a chain of events, which culminate into a shocking discovery. Rekka is the last surviving member of a legendary ninja clan that was wiped out centuries ago. Even more astonishing than being an actual ninja, he also wields the power to control fire. What does this mean for Rekka? Who are these strange people after him and Yanagi? Find out in  Rekka no Honoo !","['Action', 'Adventure', 'Martial Arts', 'Shounen', 'Super Power']","Jul 19, 1997 to Jul 10, 1998",42.0,47732,1958,2074.0,7.41,https://cdn.myanimelist.net/images/anime/6/22466.jpg,https://myanimelist.net/anime/238/Rekka_no_Honoo
14267,Persona 4 the Animation: The Factor of Hope,"Recap of the entire 25-episode television anime series with new cuts and also the unaired ""True End Episode"" that was included in the 10th Blu-ray Disc/DVD volume.","['Adventure', 'Mystery', 'Super Power', 'Supernatural', 'School']","Jun 9, 2012",1.0,14504,3721,2073.0,7.41,https://cdn.myanimelist.net/images/anime/3/50415.jpg,https://myanimelist.net/anime/14267/Persona_4_the_Animation__The_Factor_of_Hope
